Title,Authors,Year,PDF URL,File Path
PolyDiffuse: Polygonal Shape Reconstruction via Guided Set Diffusion Models,,2023,https://papers.nips.cc/paper_files/paper/2023/file/05f0e2fa003602db2d98ca72b79dec51-Paper-Conference.pdf,F:\neurips_papers_python\2023\PolyDiffuse_ Polygonal Shape Reconstruction via Guided Set Diffusion Models.pdf
The Distortion of Binomial Voting Defies Expectation,,2023,https://papers.nips.cc/paper_files/paper/2023/file/06cb881ec90a657a8f949a62f1b4ee5f-Paper-Conference.pdf,F:\neurips_papers_python\2023\The Distortion of Binomial Voting Defies Expectation.pdf
Regularized Behavior Cloning for Blocking the Leakage of Past Action Information,,2023,https://papers.nips.cc/paper_files/paper/2023/file/06b71ad997f7e3e4b2e2f2ea12e5a759-Paper-Conference.pdf,F:\neurips_papers_python\2023\Regularized Behavior Cloning for Blocking the Leakage of Past Action Information.pdf
Compression with Bayesian Implicit Neural Representations,,2023,https://papers.nips.cc/paper_files/paper/2023/file/060b2af0081a460f7f466f7f174d9052-Paper-Conference.pdf,F:\neurips_papers_python\2023\Compression with Bayesian Implicit Neural Representations.pdf
On the Generalization Properties of Diffusion Models,,2023,https://papers.nips.cc/paper_files/paper/2023/file/06abed94583030dd50abe6767bd643b1-Paper-Conference.pdf,F:\neurips_papers_python\2023\On the Generalization Properties of Diffusion Models.pdf
Optimistic Rates for Multi-Task Representation Learning,,2023,https://papers.nips.cc/paper_files/paper/2023/file/06e3c330d140f3a25671acf2dc2d6357-Paper-Conference.pdf,F:\neurips_papers_python\2023\Optimistic Rates for Multi-Task Representation Learning.pdf
Navigating Data Heterogeneity in Federated Learning: A Semi-Supervised Federated Object Detection,,2023,https://papers.nips.cc/paper_files/paper/2023/file/066e4dbfeccb5dc2851acd5eca584937-Paper-Conference.pdf,F:\neurips_papers_python\2023\Navigating Data Heterogeneity in Federated Learning_ A Semi-Supervised Federated Object Detection.pdf
"Patch n’ Pack: NaViT, a Vision Transformer for any Aspect Ratio and Resolution",,2023,https://papers.nips.cc/paper_files/paper/2023/file/06ea400b9b7cfce6428ec27a371632eb-Paper-Conference.pdf,"F:\neurips_papers_python\2023\Patch n’ Pack_ NaViT, a Vision Transformer for any Aspect Ratio and Resolution.pdf"
Honesty Is the Best Policy: Defining and Mitigating AI Deception,,2023,https://papers.nips.cc/paper_files/paper/2023/file/06fc7ae4a11a7eb5e20fe018db6c036f-Paper-Conference.pdf,F:\neurips_papers_python\2023\Honesty Is the Best Policy_ Defining and Mitigating AI Deception.pdf
The Benefits of Being Distributional: Small-Loss Bounds for Reinforcement Learning,,2023,https://papers.nips.cc/paper_files/paper/2023/file/06fc38f5c21ae66ef955e28b7a78ece5-Paper-Conference.pdf,F:\neurips_papers_python\2023\The Benefits of Being Distributional_ Small-Loss Bounds for Reinforcement Learning.pdf
A Bounded Ability Estimation for Computerized Adaptive Testing,,2023,https://papers.nips.cc/paper_files/paper/2023/file/0730b81dbc16cce7e85b519cb7fe5a8d-Paper-Conference.pdf,F:\neurips_papers_python\2023\A Bounded Ability Estimation for Computerized Adaptive Testing.pdf
Uncovering and Quantifying Social Biases in Code Generation,,2023,https://papers.nips.cc/paper_files/paper/2023/file/071a637d41ea290ac4360818a8323f33-Paper-Conference.pdf,F:\neurips_papers_python\2023\Uncovering and Quantifying Social Biases in Code Generation.pdf
UP-DP: Unsupervised Prompt Learning for Data Pre-Selection with Vision-Language Models,,2023,https://papers.nips.cc/paper_files/paper/2023/file/06d5f1fe6509b001e6d4e0ec1afd83dd-Paper-Conference.pdf,F:\neurips_papers_python\2023\UP-DP_ Unsupervised Prompt Learning for Data Pre-Selection with Vision-Language Models.pdf
Exact Bayesian Inference on Discrete Models via Probability Generating Functions: A Probabilistic Programming Approach,,2023,https://papers.nips.cc/paper_files/paper/2023/file/0747af6f877c0cb555fea595f01b0e83-Paper-Conference.pdf,F:\neurips_papers_python\2023\Exact Bayesian Inference on Discrete Models via Probability Generating Functions_ A Probabilistic Programming Approach.pdf
Principle-Driven Self-Alignment of Language Models from Scratch with Minimal Human Supervision,,2023,https://papers.nips.cc/paper_files/paper/2023/file/0764db1151b936aca59249e2c1386101-Paper-Conference.pdf,F:\neurips_papers_python\2023\Principle-Driven Self-Alignment of Language Models from Scratch with Minimal Human Supervision.pdf
ForecastPFN: Synthetically-Trained Zero-Shot Forecasting,,2023,https://papers.nips.cc/paper_files/paper/2023/file/0731f0e65559059eb9cd9d6f44ce2dd8-Paper-Conference.pdf,F:\neurips_papers_python\2023\ForecastPFN_ Synthetically-Trained Zero-Shot Forecasting.pdf
Emergent Correspondence from Image Diffusion,,2023,https://papers.nips.cc/paper_files/paper/2023/file/0503f5dce343a1d06d16ba103dd52db1-Paper-Conference.pdf,F:\neurips_papers_python\2023\Emergent Correspondence from Image Diffusion.pdf
Double Gumbel Q-Learning,,2023,https://papers.nips.cc/paper_files/paper/2023/file/07956d40074d6523bad11112b3225c6e-Paper-Conference.pdf,F:\neurips_papers_python\2023\Double Gumbel Q-Learning.pdf
An Efficient End-to-End Training Approach for Zero-Shot Human-AI Coordination,,2023,https://papers.nips.cc/paper_files/paper/2023/file/07a363fd2263091c2063998e0034999c-Paper-Conference.pdf,F:\neurips_papers_python\2023\An Efficient End-to-End Training Approach for Zero-Shot Human-AI Coordination.pdf
Computing Optimal Equilibria and Mechanisms via Learning in Zero-Sum Extensive-Form Games,,2023,https://papers.nips.cc/paper_files/paper/2023/file/07be1a0850e58ca29e2b6ce31fc0c791-Paper-Conference.pdf,F:\neurips_papers_python\2023\Computing Optimal Equilibria and Mechanisms via Learning in Zero-Sum Extensive-Form Games.pdf
Mutual-Information Regularized Multi-Agent Policy Iteration,,2023,https://papers.nips.cc/paper_files/paper/2023/file/0799492e7be38b66d10ead5e8809616d-Paper-Conference.pdf,F:\neurips_papers_python\2023\Mutual-Information Regularized Multi-Agent Policy Iteration.pdf
Estimating the Rate-Distortion Function by Wasserstein Gradient Descent,,2023,https://papers.nips.cc/paper_files/paper/2023/file/07eea3fb833c905c5edf46f914231f15-Paper-Conference.pdf,F:\neurips_papers_python\2023\Estimating the Rate-Distortion Function by Wasserstein Gradient Descent.pdf
Searching for Optimal Per-Coordinate Step-sizes with Multidimensional Backtracking,,2023,https://papers.nips.cc/paper_files/paper/2023/file/07e436cdeb48e2a67618274f5d5eff85-Paper-Conference.pdf,F:\neurips_papers_python\2023\Searching for Optimal Per-Coordinate Step-sizes with Multidimensional Backtracking.pdf
Prototypical Variational Autoencoder for 3D Few-shot Object Detection,,2023,https://papers.nips.cc/paper_files/paper/2023/file/076a93fd42aa85f5ccee921a01d77dd5-Paper-Conference.pdf,F:\neurips_papers_python\2023\Prototypical Variational Autoencoder for 3D Few-shot Object Detection.pdf
Consistent Aggregation of Objectives with Diverse Time Preferences Requires Non-Markovian Rewards,,2023,https://papers.nips.cc/paper_files/paper/2023/file/08342dc6ab69f23167b4123086ad4d38-Paper-Conference.pdf,F:\neurips_papers_python\2023\Consistent Aggregation of Objectives with Diverse Time Preferences Requires Non-Markovian Rewards.pdf
Theoretically Guaranteed Bidirectional Data Rectification for Robust Sequential Recommendation,,2023,https://papers.nips.cc/paper_files/paper/2023/file/08309150af77fc7c79ade0bf8bb6a562-Paper-Conference.pdf,F:\neurips_papers_python\2023\Theoretically Guaranteed Bidirectional Data Rectification for Robust Sequential Recommendation.pdf
Neural Lyapunov Control for Discrete-Time Systems,,2023,https://papers.nips.cc/paper_files/paper/2023/file/08bf1773e94763b6cc366ee7c6582f27-Paper-Conference.pdf,F:\neurips_papers_python\2023\Neural Lyapunov Control for Discrete-Time Systems.pdf
InstanT: Semi-supervised Learning with Instance-dependent Thresholds,,2023,https://papers.nips.cc/paper_files/paper/2023/file/088d99765bc121c6df215da7d45bc4e9-Paper-Conference.pdf,F:\neurips_papers_python\2023\InstanT_ Semi-supervised Learning with Instance-dependent Thresholds.pdf
Improving *day-ahead* Solar Irradiance Time Series Forecasting by Leveraging Spatio-Temporal Context,,2023,https://papers.nips.cc/paper_files/paper/2023/file/070a57c5ef1e58cc90201b11d369b3c2-Paper-Conference.pdf,F:\neurips_papers_python\2023\Improving _day-ahead_ Solar Irradiance Time Series Forecasting by Leveraging Spatio-Temporal Context.pdf
Mip-Grid: Anti-aliased Grid Representations for Neural Radiance Fields,,2023,https://papers.nips.cc/paper_files/paper/2023/file/082d3d795520c43214da5123e56a3a34-Paper-Conference.pdf,F:\neurips_papers_python\2023\Mip-Grid_ Anti-aliased Grid Representations for Neural Radiance Fields.pdf
Diffusion-Based Adversarial Sample Generation for Improved Stealthiness and Controllability,,2023,https://papers.nips.cc/paper_files/paper/2023/file/088463cd3126aef2002ffc69da42ec59-Paper-Conference.pdf,F:\neurips_papers_python\2023\Diffusion-Based Adversarial Sample Generation for Improved Stealthiness and Controllability.pdf
HotBEV: Hardware-oriented Transformer-based Multi-View 3D Detector for BEV Perception,,2023,https://papers.nips.cc/paper_files/paper/2023/file/081b08068e4733ae3e7ad019fe8d172f-Paper-Conference.pdf,F:\neurips_papers_python\2023\HotBEV_ Hardware-oriented Transformer-based Multi-View 3D Detector for BEV Perception.pdf
Transformed Low-Rank Parameterization Can Help Robust Generalization for Tensor Neural Networks,,2023,https://papers.nips.cc/paper_files/paper/2023/file/092c2d45005ea2db40fc24c470663416-Paper-Conference.pdf,F:\neurips_papers_python\2023\Transformed Low-Rank Parameterization Can Help Robust Generalization for Tensor Neural Networks.pdf
Testing the General Deductive Reasoning Capacity of Large Language Models Using OOD Examples,,2023,https://papers.nips.cc/paper_files/paper/2023/file/09425891e393e64b0535194a81ba15b7-Paper-Conference.pdf,F:\neurips_papers_python\2023\Testing the General Deductive Reasoning Capacity of Large Language Models Using OOD Examples.pdf
Evolving Connectivity for Recurrent Spiking Neural Networks,,2023,https://papers.nips.cc/paper_files/paper/2023/file/08f9de0232c0b485110237f6e6cf88f1-Paper-Conference.pdf,F:\neurips_papers_python\2023\Evolving Connectivity for Recurrent Spiking Neural Networks.pdf
GraphMP: Graph Neural Network-based Motion Planning with Efficient Graph Search,,2023,https://papers.nips.cc/paper_files/paper/2023/file/096961cae3c3423c44ea045aeb584e05-Paper-Conference.pdf,F:\neurips_papers_python\2023\GraphMP_ Graph Neural Network-based Motion Planning with Efficient Graph Search.pdf
Epistemic Neural Networks,,2023,https://papers.nips.cc/paper_files/paper/2023/file/07fbde96bee50f4e09303fd4f877c2f3-Paper-Conference.pdf,F:\neurips_papers_python\2023\Epistemic Neural Networks.pdf
Finding Counterfactually Optimal Action Sequences in Continuous State Spaces,,2023,https://papers.nips.cc/paper_files/paper/2023/file/09ae6beae5f1ff38f05c05979097ea0f-Paper-Conference.pdf,F:\neurips_papers_python\2023\Finding Counterfactually Optimal Action Sequences in Continuous State Spaces.pdf
Reusing Pretrained Models by Multi-linear Operators for Efficient Training,,2023,https://papers.nips.cc/paper_files/paper/2023/file/09d9a13f7018110cfb439c06b07940a2-Paper-Conference.pdf,F:\neurips_papers_python\2023\Reusing Pretrained Models by Multi-linear Operators for Efficient Training.pdf
Bayesian Optimization with Cost-varying Variable Subsets,,2023,https://papers.nips.cc/paper_files/paper/2023/file/090b23d52bc2722eef2fbf79c5ebf9ec-Paper-Conference.pdf,F:\neurips_papers_python\2023\Bayesian Optimization with Cost-varying Variable Subsets.pdf
Sample Complexity Bounds for Score-Matching: Causal Discovery and Generative Modeling,,2023,https://papers.nips.cc/paper_files/paper/2023/file/0a3dc35a2391cabcb59a6b123544e3db-Paper-Conference.pdf,F:\neurips_papers_python\2023\Sample Complexity Bounds for Score-Matching_ Causal Discovery and Generative Modeling.pdf
Parts of Speech–Grounded Subspaces in Vision-Language Models,,2023,https://papers.nips.cc/paper_files/paper/2023/file/07cf32cf61224da628157b7ed0ce994a-Paper-Conference.pdf,F:\neurips_papers_python\2023\Parts of Speech–Grounded Subspaces in Vision-Language Models.pdf
Type-to-Track: Retrieve Any Object via Prompt-based Tracking,,2023,https://papers.nips.cc/paper_files/paper/2023/file/098491b37deebbe6c007e69815729e09-Paper-Conference.pdf,F:\neurips_papers_python\2023\Type-to-Track_ Retrieve Any Object via Prompt-based Tracking.pdf
SOAR: Improved Indexing for Approximate Nearest Neighbor Search,,2023,https://papers.nips.cc/paper_files/paper/2023/file/0973524e02a712af33325d0688ae6f49-Paper-Conference.pdf,F:\neurips_papers_python\2023\SOAR_ Improved Indexing for Approximate Nearest Neighbor Search.pdf
A Path to Simpler Models Starts With Noise,,2023,https://papers.nips.cc/paper_files/paper/2023/file/0a49935d2b3d3342ca08d6db0adcfa34-Paper-Conference.pdf,F:\neurips_papers_python\2023\A Path to Simpler Models Starts With Noise.pdf
"Zeroth-Order Methods for Nondifferentiable, Nonconvex, and Hierarchical Federated Optimization",,2023,https://papers.nips.cc/paper_files/paper/2023/file/0a70c9cd8179fe6f8f6135fafa2a8798-Paper-Conference.pdf,"F:\neurips_papers_python\2023\Zeroth-Order Methods for Nondifferentiable, Nonconvex, and Hierarchical Federated Optimization.pdf"
Winner-Take-All Column Row Sampling for Memory Efficient Adaptation of Language Model,,2023,https://papers.nips.cc/paper_files/paper/2023/file/0a6059857ae5c82ea9726ee9282a7145-Paper-Conference.pdf,F:\neurips_papers_python\2023\Winner-Take-All Column Row Sampling for Memory Efficient Adaptation of Language Model.pdf
Language Model Alignment with Elastic Reset,,2023,https://papers.nips.cc/paper_files/paper/2023/file/0a980183c520446f6b8afb6fa2a2c70e-Paper-Conference.pdf,F:\neurips_papers_python\2023\Language Model Alignment with Elastic Reset.pdf
Resolving the Tug-of-War: A Separation of Communication and Learning in Federated Learning,,2023,https://papers.nips.cc/paper_files/paper/2023/file/0aa800df4298539770b57824afc77a89-Paper-Conference.pdf,F:\neurips_papers_python\2023\Resolving the Tug-of-War_ A Separation of Communication and Learning in Federated Learning.pdf
Adversarial Robustness in Graph Neural Networks: A Hamiltonian Approach,,2023,https://papers.nips.cc/paper_files/paper/2023/file/0a443a000e1cb2281480b3bac395b3b8-Paper-Conference.pdf,F:\neurips_papers_python\2023\Adversarial Robustness in Graph Neural Networks_ A Hamiltonian Approach.pdf
Learning Rule-Induced Subgraph Representations for Inductive Relation Prediction,,2023,https://papers.nips.cc/paper_files/paper/2023/file/0b06c8673ebb453e5e468f7743d8f54e-Paper-Conference.pdf,F:\neurips_papers_python\2023\Learning Rule-Induced Subgraph Representations for Inductive Relation Prediction.pdf
Accountability in Offline Reinforcement Learning: Explaining Decisions with a Corpus of Examples,,2023,https://papers.nips.cc/paper_files/paper/2023/file/096b1019463f34eb241e87cfce8dfe16-Paper-Conference.pdf,F:\neurips_papers_python\2023\Accountability in Offline Reinforcement Learning_ Explaining Decisions with a Corpus of Examples.pdf
Linguistic Binding in Diffusion Models: Enhancing Attribute Correspondence through Attention Map Alignment,,2023,https://papers.nips.cc/paper_files/paper/2023/file/0b08d733a5d45a547344c4e9d88bb8bc-Paper-Conference.pdf,F:\neurips_papers_python\2023\Linguistic Binding in Diffusion Models_ Enhancing Attribute Correspondence through Attention Map Alignment.pdf
Optimistic Natural Policy Gradient: a Simple Efficient Policy Optimization Framework  for Online RL,,2023,https://papers.nips.cc/paper_files/paper/2023/file/0b13c22ca208bc08f3fd13793292f25f-Paper-Conference.pdf,F:\neurips_papers_python\2023\Optimistic Natural Policy Gradient_ a Simple Efficient Policy Optimization Framework  for Online RL.pdf
Two-Stage Learning to Defer with Multiple Experts,,2023,https://papers.nips.cc/paper_files/paper/2023/file/0b17d256cf1fe1cc084922a8c6b565b7-Paper-Conference.pdf,F:\neurips_papers_python\2023\Two-Stage Learning to Defer with Multiple Experts.pdf
FlowCam: Training Generalizable 3D Radiance Fields without Camera Poses via Pixel-Aligned Scene Flow,,2023,https://papers.nips.cc/paper_files/paper/2023/file/0534abc9e6db91683d82186ef0d68202-Paper-Conference.pdf,F:\neurips_papers_python\2023\FlowCam_ Training Generalizable 3D Radiance Fields without Camera Poses via Pixel-Aligned Scene Flow.pdf
A Computationally Efficient Sparsified Online Newton Method,,2023,https://papers.nips.cc/paper_files/paper/2023/file/0b43289db08ed60edc6451cb2132e203-Paper-Conference.pdf,F:\neurips_papers_python\2023\A Computationally Efficient Sparsified Online Newton Method.pdf
SparseProp: Efficient Event-Based Simulation and Training of Sparse Recurrent Spiking Neural Networks,,2023,https://papers.nips.cc/paper_files/paper/2023/file/0b443d358a391166d1fbf551fb53de02-Paper-Conference.pdf,F:\neurips_papers_python\2023\SparseProp_ Efficient Event-Based Simulation and Training of Sparse Recurrent Spiking Neural Networks.pdf
OBJECT 3DIT: Language-guided 3D-aware Image Editing,,2023,https://papers.nips.cc/paper_files/paper/2023/file/0b0153a91f827b14e8bfea4e211362f3-Paper-Conference.pdf,F:\neurips_papers_python\2023\OBJECT 3DIT_ Language-guided 3D-aware Image Editing.pdf
DIFUSCO: Graph-based Diffusion Solvers for Combinatorial Optimization,,2023,https://papers.nips.cc/paper_files/paper/2023/file/0ba520d93c3df592c83a611961314c98-Paper-Conference.pdf,F:\neurips_papers_python\2023\DIFUSCO_ Graph-based Diffusion Solvers for Combinatorial Optimization.pdf
DreamSparse: Escaping from Plato’s Cave with 2D Diffusion Model Given Sparse Views,,2023,https://papers.nips.cc/paper_files/paper/2023/file/0a003511b09274348b8117f5f3b94c93-Paper-Conference.pdf,F:\neurips_papers_python\2023\DreamSparse_ Escaping from Plato’s Cave with 2D Diffusion Model Given Sparse Views.pdf
MosaicBERT: A Bidirectional Encoder Optimized for Fast Pretraining,,2023,https://papers.nips.cc/paper_files/paper/2023/file/095a6917768712b7ccc61acbeecad1d8-Paper-Conference.pdf,F:\neurips_papers_python\2023\MosaicBERT_ A Bidirectional Encoder Optimized for Fast Pretraining.pdf
Fair Canonical Correlation Analysis,,2023,https://papers.nips.cc/paper_files/paper/2023/file/0b8e4c8468273ee3bafb288229c0acbc-Paper-Conference.pdf,F:\neurips_papers_python\2023\Fair Canonical Correlation Analysis.pdf
Double Auctions with Two-sided Bandit Feedback,,2023,https://papers.nips.cc/paper_files/paper/2023/file/0bcfb525c8f8f07ae10a93d0b2a40e00-Paper-Conference.pdf,F:\neurips_papers_python\2023\Double Auctions with Two-sided Bandit Feedback.pdf
Temporal Conditioning Spiking Latent Variable Models of the Neural Response to Natural Visual Scenes,,2023,https://papers.nips.cc/paper_files/paper/2023/file/0bcf9cf6ffe26bba3af99e18be0e1d8d-Paper-Conference.pdf,F:\neurips_papers_python\2023\Temporal Conditioning Spiking Latent Variable Models of the Neural Response to Natural Visual Scenes.pdf
Enhancing Robot Program Synthesis Through Environmental Context,,2023,https://papers.nips.cc/paper_files/paper/2023/file/0c1e94af650f5c74b1f3da467c2308c2-Paper-Conference.pdf,F:\neurips_papers_python\2023\Enhancing Robot Program Synthesis Through Environmental Context.pdf
Understanding Deep Gradient Leakage via Inversion Influence Functions,,2023,https://papers.nips.cc/paper_files/paper/2023/file/0c4dd7e3d9f528f0b4f2aca9fbcdca8d-Paper-Conference.pdf,F:\neurips_papers_python\2023\Understanding Deep Gradient Leakage via Inversion Influence Functions.pdf
Bayesian Learning of Optimal Policies in Markov Decision Processes with Countably Infinite State-Space,,2023,https://papers.nips.cc/paper_files/paper/2023/file/0c79d6ed1788653643a1ac67b6ea32a7-Paper-Conference.pdf,F:\neurips_papers_python\2023\Bayesian Learning of Optimal Policies in Markov Decision Processes with Countably Infinite State-Space.pdf
Joint Learning of Label and Environment Causal Independence for Graph Out-of-Distribution Generalization,,2023,https://papers.nips.cc/paper_files/paper/2023/file/0c6c92a0c5237761168eafd4549f1584-Paper-Conference.pdf,F:\neurips_papers_python\2023\Joint Learning of Label and Environment Causal Independence for Graph Out-of-Distribution Generalization.pdf
Diffused Redundancy in Pre-trained Representations,,2023,https://papers.nips.cc/paper_files/paper/2023/file/0c86142265c5e2c900613dd1d031cb90-Paper-Conference.pdf,F:\neurips_papers_python\2023\Diffused Redundancy in Pre-trained Representations.pdf
Online Clustering of Bandits with Misspecified User Models,,2023,https://papers.nips.cc/paper_files/paper/2023/file/0bcd8d153b8c548629eca53f4ebdeb42-Paper-Conference.pdf,F:\neurips_papers_python\2023\Online Clustering of Bandits with Misspecified User Models.pdf
Randomized Sparse Neural Galerkin Schemes for Solving Evolution Equations with Deep Networks,,2023,https://papers.nips.cc/paper_files/paper/2023/file/0cb310ed8121549488fea8e8c2056096-Paper-Conference.pdf,F:\neurips_papers_python\2023\Randomized Sparse Neural Galerkin Schemes for Solving Evolution Equations with Deep Networks.pdf
AI for Interpretable Chemistry: Predicting Radical Mechanistic Pathways via Contrastive Learning,,2023,https://papers.nips.cc/paper_files/paper/2023/file/0ca70969597da7166128f7755c64ffd5-Paper-Conference.pdf,F:\neurips_papers_python\2023\AI for Interpretable Chemistry_ Predicting Radical Mechanistic Pathways via Contrastive Learning.pdf
Handling Data Heterogeneity via Architectural Design for Federated Visual Recognition,,2023,https://papers.nips.cc/paper_files/paper/2023/file/0ccd06ff26fd6a7829293ce90e0e7f7d-Paper-Conference.pdf,F:\neurips_papers_python\2023\Handling Data Heterogeneity via Architectural Design for Federated Visual Recognition.pdf
CARE: Modeling Interacting Dynamics Under Temporal Environmental Variation,,2023,https://papers.nips.cc/paper_files/paper/2023/file/0c7ca207a051228f978971447a56464a-Paper-Conference.pdf,F:\neurips_papers_python\2023\CARE_ Modeling Interacting Dynamics Under Temporal Environmental Variation.pdf
"Optimality in Mean Estimation: Beyond Worst-Case, Beyond Sub-Gaussian, and Beyond $1+\alpha$ Moments",,2023,https://papers.nips.cc/paper_files/paper/2023/file/0cddb777d3441326544e21b67f41bdc8-Paper-Conference.pdf,"F:\neurips_papers_python\2023\Optimality in Mean Estimation_ Beyond Worst-Case, Beyond Sub-Gaussian, and Beyond $1+_alpha$ Moments.pdf"
Provably Efficient Offline Goal-Conditioned Reinforcement Learning with General Function Approximation and Single-Policy Concentrability,,2023,https://papers.nips.cc/paper_files/paper/2023/file/0cfc9404f89400c5ed897035e0d3748c-Paper-Conference.pdf,F:\neurips_papers_python\2023\Provably Efficient Offline Goal-Conditioned Reinforcement Learning with General Function Approximation and Single-Policy Concentrability.pdf
SQ Lower Bounds for Non-Gaussian Component Analysis with Weaker Assumptions,,2023,https://papers.nips.cc/paper_files/paper/2023/file/0d00a699f60e642b310eb04b76cc7731-Paper-Conference.pdf,F:\neurips_papers_python\2023\SQ Lower Bounds for Non-Gaussian Component Analysis with Weaker Assumptions.pdf
"Spatial-frequency channels, shape bias, and adversarial robustness",,2023,https://papers.nips.cc/paper_files/paper/2023/file/0cdc1e85736d9c01d366cbf9b4b81672-Paper-Conference.pdf,"F:\neurips_papers_python\2023\Spatial-frequency channels, shape bias, and adversarial robustness.pdf"
Kernelized Reinforcement Learning with Order Optimal Regret Bounds,,2023,https://papers.nips.cc/paper_files/paper/2023/file/0d17d033059bacd127f25ab28784f829-Paper-Conference.pdf,F:\neurips_papers_python\2023\Kernelized Reinforcement Learning with Order Optimal Regret Bounds.pdf
Parallel Sampling of Diffusion Models,,2023,https://papers.nips.cc/paper_files/paper/2023/file/0d1986a61e30e5fa408c81216a616e20-Paper-Conference.pdf,F:\neurips_papers_python\2023\Parallel Sampling of Diffusion Models.pdf
Fractal Landscapes in Policy Optimization,,2023,https://papers.nips.cc/paper_files/paper/2023/file/0d21f257b5288385cb6cb8e0ff2ce82e-Paper-Conference.pdf,F:\neurips_papers_python\2023\Fractal Landscapes in Policy Optimization.pdf
Moral Responsibility for AI Systems,,2023,https://papers.nips.cc/paper_files/paper/2023/file/0d5b7fd8c669fac58d6702188ed63afa-Paper-Conference.pdf,F:\neurips_papers_python\2023\Moral Responsibility for AI Systems.pdf
Finite-Time Logarithmic Bayes Regret Upper Bounds,,2023,https://papers.nips.cc/paper_files/paper/2023/file/0d9057d84a9fc37523bf826232ea6820-Paper-Conference.pdf,F:\neurips_papers_python\2023\Finite-Time Logarithmic Bayes Regret Upper Bounds.pdf
Characterizing the Impacts of Semi-supervised Learning for Weak Supervision,,2023,https://papers.nips.cc/paper_files/paper/2023/file/0d6270381e018b3d83eb9be7d0b06036-Paper-Conference.pdf,F:\neurips_papers_python\2023\Characterizing the Impacts of Semi-supervised Learning for Weak Supervision.pdf
Frequency-Enhanced Data Augmentation for Vision-and-Language Navigation,,2023,https://papers.nips.cc/paper_files/paper/2023/file/0d9e08f247ca7fbbfd5e50b7ff9cf357-Paper-Conference.pdf,F:\neurips_papers_python\2023\Frequency-Enhanced Data Augmentation for Vision-and-Language Navigation.pdf
QuIP: 2-Bit Quantization of Large Language Models With Guarantees,,2023,https://papers.nips.cc/paper_files/paper/2023/file/0df38cd13520747e1e64e5b123a78ef8-Paper-Conference.pdf,F:\neurips_papers_python\2023\QuIP_ 2-Bit Quantization of Large Language Models With Guarantees.pdf
Language Quantized AutoEncoders: Towards Unsupervised Text-Image Alignment,,2023,https://papers.nips.cc/paper_files/paper/2023/file/0df1738319f8c6e15b58cb16ea3cfa57-Paper-Conference.pdf,F:\neurips_papers_python\2023\Language Quantized AutoEncoders_ Towards Unsupervised Text-Image Alignment.pdf
