Title,Authors,Year,PDF URL,File Path
Adaptive Selective Sampling for Online Prediction with Experts,,2023,https://papers.nips.cc/paper_files/paper/2023/file/00b67df24009747e8bbed4c2c6f9c825-Paper-Conference.pdf,F:\neurips_papers_python\2023\Adaptive Selective Sampling for Online Prediction with Experts.pdf
Path following algorithms for $\ell_2$-regularized $M$-estimation with approximation guarantee,,2023,https://papers.nips.cc/paper_files/paper/2023/file/00296c0e10cd24d415c2db63ea2a2c68-Paper-Conference.pdf,F:\neurips_papers_python\2023\Path following algorithms for $_ell_2$-regularized $M$-estimation with approximation guarantee.pdf
Cross-Episodic Curriculum for Transformer Agents,,2023,https://papers.nips.cc/paper_files/paper/2023/file/001608167bb652337af5df0129aeaabd-Paper-Conference.pdf,F:\neurips_papers_python\2023\Cross-Episodic Curriculum for Transformer Agents.pdf
"Provable Adversarial Robustness for Group Equivariant Tasks: Graphs, Point Clouds, Molecules, and More",,2023,https://papers.nips.cc/paper_files/paper/2023/file/00db17c36b5435195760520efa96d99c-Paper-Conference.pdf,"F:\neurips_papers_python\2023\Provable Adversarial Robustness for Group Equivariant Tasks_ Graphs, Point Clouds, Molecules, and More.pdf"
Modelling Cellular Perturbations with the Sparse Additive Mechanism Shift Variational Autoencoder,,2023,https://papers.nips.cc/paper_files/paper/2023/file/0001ca33ba34ce0351e4612b744b3936-Paper-Conference.pdf,F:\neurips_papers_python\2023\Modelling Cellular Perturbations with the Sparse Additive Mechanism Shift Variational Autoencoder.pdf
PaintSeg: Painting Pixels for Training-free Segmentation,,2023,https://papers.nips.cc/paper_files/paper/2023/file/0021c2cb1b9b6a71ac478ea52a93b25a-Paper-Conference.pdf,F:\neurips_papers_python\2023\PaintSeg_ Painting Pixels for Training-free Segmentation.pdf
Bootstrapping Vision-Language Learning with Decoupled Language Pre-training,,2023,https://papers.nips.cc/paper_files/paper/2023/file/002262941c9edfd472a79298b2ac5e17-Paper-Conference.pdf,F:\neurips_papers_python\2023\Bootstrapping Vision-Language Learning with Decoupled Language Pre-training.pdf
Natural Actor-Critic for Robust Reinforcement Learning with Function Approximation,,2023,https://papers.nips.cc/paper_files/paper/2023/file/007f4927e60699392425f267d43f0940-Paper-Conference.pdf,F:\neurips_papers_python\2023\Natural Actor-Critic for Robust Reinforcement Learning with Function Approximation.pdf
Attentive Transfer Entropy to Exploit Transient Emergence of Coupling Effect,,2023,https://papers.nips.cc/paper_files/paper/2023/file/00bb4e415ef117f2dee2fc3b778d806d-Paper-Conference.pdf,F:\neurips_papers_python\2023\Attentive Transfer Entropy to Exploit Transient Emergence of Coupling Effect.pdf
TexQ: Zero-shot Network Quantization with Texture Feature Distribution Calibration,,2023,https://papers.nips.cc/paper_files/paper/2023/file/0113ef4642264adc2e6924a3cbbdf532-Paper-Conference.pdf,F:\neurips_papers_python\2023\TexQ_ Zero-shot Network Quantization with Texture Feature Distribution Calibration.pdf
Scalable Membership Inference Attacks via Quantile Regression,,2023,https://papers.nips.cc/paper_files/paper/2023/file/01328d0767830e73a612f9073e9ff15f-Paper-Conference.pdf,F:\neurips_papers_python\2023\Scalable Membership Inference Attacks via Quantile Regression.pdf
ESSEN: Improving Evolution State Estimation for Temporal Networks using Von Neumann Entropy,,2023,https://papers.nips.cc/paper_files/paper/2023/file/0147d967a5db3b8dde08d2a327b24568-Paper-Conference.pdf,F:\neurips_papers_python\2023\ESSEN_ Improving Evolution State Estimation for Temporal Networks using Von Neumann Entropy.pdf
Self-Supervised Motion Magnification by Backpropagating Through Optical Flow,,2023,https://papers.nips.cc/paper_files/paper/2023/file/00ed9ab006311be67879ecef8f80d7c5-Paper-Conference.pdf,F:\neurips_papers_python\2023\Self-Supervised Motion Magnification by Backpropagating Through Optical Flow.pdf
Diffused Task-Agnostic Milestone Planner,,2023,https://papers.nips.cc/paper_files/paper/2023/file/0163ca1c69f848e766cfb0b7bb7e17f4-Paper-Conference.pdf,F:\neurips_papers_python\2023\Diffused Task-Agnostic Milestone Planner.pdf
Label Correction of Crowdsourced Noisy Annotations with an Instance-Dependent Noise Transition Model,,2023,https://papers.nips.cc/paper_files/paper/2023/file/015a8c69bedcb0a7b2ed2e1678f34399-Paper-Conference.pdf,F:\neurips_papers_python\2023\Label Correction of Crowdsourced Noisy Annotations with an Instance-Dependent Noise Transition Model.pdf
ANTN: Bridging Autoregressive Neural Networks and Tensor Networks for Quantum Many-Body Simulation,,2023,https://papers.nips.cc/paper_files/paper/2023/file/01772a8b0420baec00c4d59fe2fbace6-Paper-Conference.pdf,F:\neurips_papers_python\2023\ANTN_ Bridging Autoregressive Neural Networks and Tensor Networks for Quantum Many-Body Simulation.pdf
Task-aware Distributed Source Coding under Dynamic Bandwidth,,2023,https://papers.nips.cc/paper_files/paper/2023/file/016c63403370d81c24c1ca0123de6cfa-Paper-Conference.pdf,F:\neurips_papers_python\2023\Task-aware Distributed Source Coding under Dynamic Bandwidth.pdf
Causal Effect Identification in Uncertain Causal Networks,,2023,https://papers.nips.cc/paper_files/paper/2023/file/017c897b4d85a744f345ccbf9d71e501-Paper-Conference.pdf,F:\neurips_papers_python\2023\Causal Effect Identification in Uncertain Causal Networks.pdf
FAST: a Fused and Accurate Shrinkage Tree for Heterogeneous Treatment Effects Estimation,,2023,https://papers.nips.cc/paper_files/paper/2023/file/01830c92c6558179fa6d7fb1edff692c-Paper-Conference.pdf,F:\neurips_papers_python\2023\FAST_ a Fused and Accurate Shrinkage Tree for Heterogeneous Treatment Effects Estimation.pdf
Characterizing Graph Datasets for Node Classification: Homophily-Heterophily Dichotomy and Beyond,,2023,https://papers.nips.cc/paper_files/paper/2023/file/01b681025fdbda8e935a66cc5bb6e9de-Paper-Conference.pdf,F:\neurips_papers_python\2023\Characterizing Graph Datasets for Node Classification_ Homophily-Heterophily Dichotomy and Beyond.pdf
Equivariant Flow Matching with Hybrid Probability Transport for 3D Molecule Generation,,2023,https://papers.nips.cc/paper_files/paper/2023/file/01d64478381c33e29ed611f1719f5a37-Paper-Conference.pdf,F:\neurips_papers_python\2023\Equivariant Flow Matching with Hybrid Probability Transport for 3D Molecule Generation.pdf
Hyperbolic VAE via Latent Gaussian Distributions,,2023,https://papers.nips.cc/paper_files/paper/2023/file/01ecd39ca49ddecc5729ca996304781b-Paper-Conference.pdf,F:\neurips_papers_python\2023\Hyperbolic VAE via Latent Gaussian Distributions.pdf
Ambient Diffusion: Learning Clean Distributions from Corrupted Data,,2023,https://papers.nips.cc/paper_files/paper/2023/file/012af729c5d14d279581fc8a5db975a1-Paper-Conference.pdf,F:\neurips_papers_python\2023\Ambient Diffusion_ Learning Clean Distributions from Corrupted Data.pdf
Defending against Data-Free Model Extraction by  Distributionally Robust Defensive Training,,2023,https://papers.nips.cc/paper_files/paper/2023/file/0207c9ea9faf66c6e892c3fa3c167b75-Paper-Conference.pdf,F:\neurips_papers_python\2023\Defending against Data-Free Model Extraction by  Distributionally Robust Defensive Training.pdf
Belief Projection-Based Reinforcement Learning for Environments with Delayed Feedback,,2023,https://papers.nips.cc/paper_files/paper/2023/file/0252a434b18962c94910c07cd9a7fecc-Paper-Conference.pdf,F:\neurips_papers_python\2023\Belief Projection-Based Reinforcement Learning for Environments with Delayed Feedback.pdf
"Large language models transition from integrating across position-yoked, exponential windows to structure-yoked, power-law windows",,2023,https://papers.nips.cc/paper_files/paper/2023/file/020ad0ac6a1974e6748e4a5a48110a07-Paper-Conference.pdf,"F:\neurips_papers_python\2023\Large language models transition from integrating across position-yoked, exponential windows to structure-yoked, power-law windows.pdf"
Detecting Any Human-Object Interaction Relationship: Universal HOI Detector with Spatial Prompt Learning on Foundation Models,,2023,https://papers.nips.cc/paper_files/paper/2023/file/02687e7b22abc64e651be8da74ec610e-Paper-Conference.pdf,F:\neurips_papers_python\2023\Detecting Any Human-Object Interaction Relationship_ Universal HOI Detector with Spatial Prompt Learning on Foundation Models.pdf
Batchnorm Allows Unsupervised Radial Attacks,,2023,https://papers.nips.cc/paper_files/paper/2023/file/0266d95023740481d22d437aa8aba0e9-Paper-Conference.pdf,F:\neurips_papers_python\2023\Batchnorm Allows Unsupervised Radial Attacks.pdf
Smoothing the Landscape Boosts the Signal for SGD: Optimal Sample Complexity for Learning Single Index Models,,2023,https://papers.nips.cc/paper_files/paper/2023/file/02763667a5761ff92bb15d8751bcd223-Paper-Conference.pdf,F:\neurips_papers_python\2023\Smoothing the Landscape Boosts the Signal for SGD_ Optimal Sample Complexity for Learning Single Index Models.pdf
A Scale-Invariant Sorting Criterion to Find a Causal Order in Additive Noise Models,,2023,https://papers.nips.cc/paper_files/paper/2023/file/027e86facfe7c1ea52ca1fca7bc1402b-Paper-Conference.pdf,F:\neurips_papers_python\2023\A Scale-Invariant Sorting Criterion to Find a Causal Order in Additive Noise Models.pdf
PROTES: Probabilistic Optimization with Tensor Sampling,,2023,https://papers.nips.cc/paper_files/paper/2023/file/028957869e560af14243ac37663a471e-Paper-Conference.pdf,F:\neurips_papers_python\2023\PROTES_ Probabilistic Optimization with Tensor Sampling.pdf
A Simple Solution for Offline Imitation from Observations and Examples with Possibly Incomplete Trajectories,,2023,https://papers.nips.cc/paper_files/paper/2023/file/0203f489345567b4a048c38f507cdbfa-Paper-Conference.pdf,F:\neurips_papers_python\2023\A Simple Solution for Offline Imitation from Observations and Examples with Possibly Incomplete Trajectories.pdf
PDF: Point Diffusion Implicit Function for Large-scale Scene Neural Representation,,2023,https://papers.nips.cc/paper_files/paper/2023/file/0073cc73e1873b35345209b50a3dab66-Paper-Conference.pdf,F:\neurips_papers_python\2023\PDF_ Point Diffusion Implicit Function for Large-scale Scene Neural Representation.pdf
Perturbation Towards Easy Samples Improves Targeted Adversarial Transferability,,2023,https://papers.nips.cc/paper_files/paper/2023/file/028fcbcf85435d39a40c4d61b42c99a4-Paper-Conference.pdf,F:\neurips_papers_python\2023\Perturbation Towards Easy Samples Improves Targeted Adversarial Transferability.pdf
Conformal Prediction Sets for Ordinal Classification,,2023,https://papers.nips.cc/paper_files/paper/2023/file/029f699912bf3db747fe110948cc6169-Paper-Conference.pdf,F:\neurips_papers_python\2023\Conformal Prediction Sets for Ordinal Classification.pdf
AVIS: Autonomous Visual Information Seeking with Large Language Model Agent,,2023,https://papers.nips.cc/paper_files/paper/2023/file/029df12a9363313c3e41047844ecad94-Paper-Conference.pdf,F:\neurips_papers_python\2023\AVIS_ Autonomous Visual Information Seeking with Large Language Model Agent.pdf
Minimax-Optimal Location Estimation,,2023,https://papers.nips.cc/paper_files/paper/2023/file/02a589ef9a4f6f1e2dcc1cfb3b978a51-Paper-Conference.pdf,F:\neurips_papers_python\2023\Minimax-Optimal Location Estimation.pdf
Tight Bounds for Volumetric Spanners and Applications,,2023,https://papers.nips.cc/paper_files/paper/2023/file/02a92b52670752daf17b53f04f1ab405-Paper-Conference.pdf,F:\neurips_papers_python\2023\Tight Bounds for Volumetric Spanners and Applications.pdf
Dense-Exponential Random Features: Sharp Positive Estimators of the Gaussian Kernel,,2023,https://papers.nips.cc/paper_files/paper/2023/file/02dec8877fb7c6aa9a79f81661baca7c-Paper-Conference.pdf,F:\neurips_papers_python\2023\Dense-Exponential Random Features_ Sharp Positive Estimators of the Gaussian Kernel.pdf
Projection-Free Online Convex Optimization via Efficient Newton Iterations,,2023,https://papers.nips.cc/paper_files/paper/2023/file/03261886741f1f21f52f2a2d570616a2-Paper-Conference.pdf,F:\neurips_papers_python\2023\Projection-Free Online Convex Optimization via Efficient Newton Iterations.pdf
Read and Reap the Rewards: Learning to Play Atari with the Help of Instruction Manuals,,2023,https://papers.nips.cc/paper_files/paper/2023/file/034d7bfeace2a9a258648b16fc626298-Paper-Conference.pdf,F:\neurips_papers_python\2023\Read and Reap the Rewards_ Learning to Play Atari with the Help of Instruction Manuals.pdf
Sharpness Minimization Algorithms Do Not Only Minimize Sharpness To Achieve Better Generalization,,2023,https://papers.nips.cc/paper_files/paper/2023/file/0354767c6386386be17cabe4fc59711b-Paper-Conference.pdf,F:\neurips_papers_python\2023\Sharpness Minimization Algorithms Do Not Only Minimize Sharpness To Achieve Better Generalization.pdf
Calibrating Neural Simulation-Based Inference with Differentiable Coverage Probability,,2023,https://papers.nips.cc/paper_files/paper/2023/file/03a9a9c1e15850439653bb971a4ad4b3-Paper-Conference.pdf,F:\neurips_papers_python\2023\Calibrating Neural Simulation-Based Inference with Differentiable Coverage Probability.pdf
Feature-Learning Networks Are Consistent Across Widths At Realistic Scales,,2023,https://papers.nips.cc/paper_files/paper/2023/file/03600ae6c3392fd65ad7c3a90c6f7ce8-Paper-Conference.pdf,F:\neurips_papers_python\2023\Feature-Learning Networks Are Consistent Across Widths At Realistic Scales.pdf
Agnostic Multi-Group Active Learning,,2023,https://papers.nips.cc/paper_files/paper/2023/file/03b1043052700b1a471996b0baf309d4-Paper-Conference.pdf,F:\neurips_papers_python\2023\Agnostic Multi-Group Active Learning.pdf
Towards Higher Ranks via Adversarial Weight Pruning,,2023,https://papers.nips.cc/paper_files/paper/2023/file/040ace837dd270a87055bb10dd7c0392-Paper-Conference.pdf,F:\neurips_papers_python\2023\Towards Higher Ranks via Adversarial Weight Pruning.pdf
On the Overlooked Pitfalls of Weight Decay and How to Mitigate Them: A Gradient-Norm Perspective,,2023,https://papers.nips.cc/paper_files/paper/2023/file/040d3b6af368bf71f952c18da5713b48-Paper-Conference.pdf,F:\neurips_papers_python\2023\On the Overlooked Pitfalls of Weight Decay and How to Mitigate Them_ A Gradient-Norm Perspective.pdf
Taylor TD-learning,,2023,https://papers.nips.cc/paper_files/paper/2023/file/036912a83bdbb1fd792baf6532f102d8-Paper-Conference.pdf,F:\neurips_papers_python\2023\Taylor TD-learning.pdf
Self-Weighted Contrastive Learning among Multiple Views for Mitigating Representation Degeneration,,2023,https://papers.nips.cc/paper_files/paper/2023/file/03b13b0db740b95cb741e007178ef5e5-Paper-Conference.pdf,F:\neurips_papers_python\2023\Self-Weighted Contrastive Learning among Multiple Views for Mitigating Representation Degeneration.pdf
Adversarial Model for Offline Reinforcement Learning,,2023,https://papers.nips.cc/paper_files/paper/2023/file/0429ececfb199efc93182990169e73bb-Paper-Conference.pdf,F:\neurips_papers_python\2023\Adversarial Model for Offline Reinforcement Learning.pdf
Where are we in the search for an Artificial Visual Cortex for Embodied Intelligence?,,2023,https://papers.nips.cc/paper_files/paper/2023/file/022ca1bed6b574b962c48a2856eb207b-Paper-Conference.pdf,F:\neurips_papers_python\2023\Where are we in the search for an Artificial Visual Cortex for Embodied Intelligence_.pdf
Neural Polarizer: A Lightweight and Effective Backdoor Defense via Purifying Poisoned Features,,2023,https://papers.nips.cc/paper_files/paper/2023/file/03df5246cc78af497940338dd3eacbaa-Paper-Conference.pdf,F:\neurips_papers_python\2023\Neural Polarizer_ A Lightweight and Effective Backdoor Defense via Purifying Poisoned Features.pdf
Training Your Image Restoration Network Better with  Random Weight Network as Optimization Function,,2023,https://papers.nips.cc/paper_files/paper/2023/file/043f0503c4f652c737add3690aa5d12c-Paper-Conference.pdf,F:\neurips_papers_python\2023\Training Your Image Restoration Network Better with  Random Weight Network as Optimization Function.pdf
Passive learning of active causal strategies in agents and language models,,2023,https://papers.nips.cc/paper_files/paper/2023/file/045c87def0c02e3ad0d3d849766d7f1e-Paper-Conference.pdf,F:\neurips_papers_python\2023\Passive learning of active causal strategies in agents and language models.pdf
Zero-Regret Performative Prediction Under Inequality Constraints,,2023,https://papers.nips.cc/paper_files/paper/2023/file/047397849f63b4fcfced4ff720159f3d-Paper-Conference.pdf,F:\neurips_papers_python\2023\Zero-Regret Performative Prediction Under Inequality Constraints.pdf
Towards Free Data Selection with General-Purpose Models,,2023,https://papers.nips.cc/paper_files/paper/2023/file/047682108c3b053c61ad2da5a6057b4e-Paper-Conference.pdf,F:\neurips_papers_python\2023\Towards Free Data Selection with General-Purpose Models.pdf
Tools for Verifying Neural Models' Training Data,,2023,https://papers.nips.cc/paper_files/paper/2023/file/03e33e1f62e3302b47fe1d38a235921e-Paper-Conference.pdf,F:\neurips_papers_python\2023\Tools for Verifying Neural Models' Training Data.pdf
Partial Multi-Label Learning with Probabilistic Graphical Disambiguation,,2023,https://papers.nips.cc/paper_files/paper/2023/file/04e05ba5cbc36044f6499d1edf15247e-Paper-Conference.pdf,F:\neurips_papers_python\2023\Partial Multi-Label Learning with Probabilistic Graphical Disambiguation.pdf
Communication-Efficient Federated Bilevel Optimization with Global and Local Lower Level Problems,,2023,https://papers.nips.cc/paper_files/paper/2023/file/04bd683d5428d91c5fbb5a7d2c27064d-Paper-Conference.pdf,F:\neurips_papers_python\2023\Communication-Efficient Federated Bilevel Optimization with Global and Local Lower Level Problems.pdf
Learning better with Dale’s Law: A Spectral Perspective,,2023,https://papers.nips.cc/paper_files/paper/2023/file/02dd0db10c40092de3d9ec2508d12f60-Paper-Conference.pdf,F:\neurips_papers_python\2023\Learning better with Dale’s Law_ A Spectral Perspective.pdf
Robust Learning with Progressive Data Expansion Against Spurious Correlation,,2023,https://papers.nips.cc/paper_files/paper/2023/file/0506ad3d1bcc8398a920db9340f27fe4-Paper-Conference.pdf,F:\neurips_papers_python\2023\Robust Learning with Progressive Data Expansion Against Spurious Correlation.pdf
Multiclass Boosting: Simple and Intuitive Weak Learning Criteria,,2023,https://papers.nips.cc/paper_files/paper/2023/file/050f8591be3874b52fdac4e1060eeb29-Paper-Conference.pdf,F:\neurips_papers_python\2023\Multiclass Boosting_ Simple and Intuitive Weak Learning Criteria.pdf
Approximate Heavy Tails in Offline (Multi-Pass) Stochastic Gradient Descent,,2023,https://papers.nips.cc/paper_files/paper/2023/file/0525a72df7fb2cd943c780d059b94774-Paper-Conference.pdf,F:\neurips_papers_python\2023\Approximate Heavy Tails in Offline (Multi-Pass) Stochastic Gradient Descent.pdf
Minimum Description Length and Generalization Guarantees for Representation Learning,,2023,https://papers.nips.cc/paper_files/paper/2023/file/054e9f9a286671ababa3213d6e59c1c2-Paper-Conference.pdf,F:\neurips_papers_python\2023\Minimum Description Length and Generalization Guarantees for Representation Learning.pdf
Fixing the NTK: From Neural Network Linearizations to Exact Convex Programs,,2023,https://papers.nips.cc/paper_files/paper/2023/file/055fc19a3ce780b96cff15ffe738c1f1-Paper-Conference.pdf,F:\neurips_papers_python\2023\Fixing the NTK_ From Neural Network Linearizations to Exact Convex Programs.pdf
Birth of a Transformer: A Memory Viewpoint,,2023,https://papers.nips.cc/paper_files/paper/2023/file/0561738a239a995c8cd2ef0e50cfa4fd-Paper-Conference.pdf,F:\neurips_papers_python\2023\Birth of a Transformer_ A Memory Viewpoint.pdf
A Variational Perspective on High-Resolution ODEs,,2023,https://papers.nips.cc/paper_files/paper/2023/file/0569458210c88d8db2985799da830d27-Paper-Conference.pdf,F:\neurips_papers_python\2023\A Variational Perspective on High-Resolution ODEs.pdf
Reward Scale Robustness for Proximal Policy Optimization via DreamerV3 Tricks,,2023,https://papers.nips.cc/paper_files/paper/2023/file/04f61ec02d1b3a025a59d978269ce437-Paper-Conference.pdf,F:\neurips_papers_python\2023\Reward Scale Robustness for Proximal Policy Optimization via DreamerV3 Tricks.pdf
On the Robustness of Mechanism Design under Total Variation Distance,,2023,https://papers.nips.cc/paper_files/paper/2023/file/058983528186511a74968e88a6d0ad63-Paper-Conference.pdf,F:\neurips_papers_python\2023\On the Robustness of Mechanism Design under Total Variation Distance.pdf
Risk-Averse Model Uncertainty for Distributionally Robust Safe Reinforcement Learning,,2023,https://papers.nips.cc/paper_files/paper/2023/file/05b63fa06784b71aab3939004e0f0a0d-Paper-Conference.pdf,F:\neurips_papers_python\2023\Risk-Averse Model Uncertainty for Distributionally Robust Safe Reinforcement Learning.pdf
From Discrete Tokens to High-Fidelity Audio Using Multi-Band Diffusion,,2023,https://papers.nips.cc/paper_files/paper/2023/file/054f771d614df12fe8def8ecdbe4e8e1-Paper-Conference.pdf,F:\neurips_papers_python\2023\From Discrete Tokens to High-Fidelity Audio Using Multi-Band Diffusion.pdf
BayesDAG: Gradient-Based Posterior Inference for Causal Discovery,,2023,https://papers.nips.cc/paper_files/paper/2023/file/05cf28e3d3c9a179d789c55270fe6f72-Paper-Conference.pdf,F:\neurips_papers_python\2023\BayesDAG_ Gradient-Based Posterior Inference for Causal Discovery.pdf
A generative model of the hippocampal formation trained with theta driven local learning rules,,2023,https://papers.nips.cc/paper_files/paper/2023/file/05ab457c7b769f01c2973e2a5ab66ad9-Paper-Conference.pdf,F:\neurips_papers_python\2023\A generative model of the hippocampal formation trained with theta driven local learning rules.pdf
Optimal approximation using complex-valued neural networks,,2023,https://papers.nips.cc/paper_files/paper/2023/file/05b69cc4c8ff6e24c5de1ecd27223d37-Paper-Conference.pdf,F:\neurips_papers_python\2023\Optimal approximation using complex-valued neural networks.pdf
Leveraging Early-Stage Robustness in Diffusion Models for Efficient and High-Quality Image Synthesis,,2023,https://papers.nips.cc/paper_files/paper/2023/file/04261fce1705c4f02f062866717d592a-Paper-Conference.pdf,F:\neurips_papers_python\2023\Leveraging Early-Stage Robustness in Diffusion Models for Efficient and High-Quality Image Synthesis.pdf
Uniform-in-Time Wasserstein Stability Bounds for (Noisy) Stochastic Gradient Descent,,2023,https://papers.nips.cc/paper_files/paper/2023/file/05d6b5b6901fb57d2c287e1d3ce6d63c-Paper-Conference.pdf,F:\neurips_papers_python\2023\Uniform-in-Time Wasserstein Stability Bounds for (Noisy) Stochastic Gradient Descent.pdf
Bounce: Reliable High-Dimensional Bayesian Optimization for Combinatorial and Mixed Spaces,,2023,https://papers.nips.cc/paper_files/paper/2023/file/05d2175de7ee637588d1b5ced8b15b32-Paper-Conference.pdf,F:\neurips_papers_python\2023\Bounce_ Reliable High-Dimensional Bayesian Optimization for Combinatorial and Mixed Spaces.pdf
Towards Generic Semi-Supervised Framework for Volumetric Medical Image Segmentation,,2023,https://papers.nips.cc/paper_files/paper/2023/file/05dc08730e32441edff52b0fa6caab5f-Paper-Conference.pdf,F:\neurips_papers_python\2023\Towards Generic Semi-Supervised Framework for Volumetric Medical Image Segmentation.pdf
What You See is What You Read? Improving Text-Image Alignment Evaluation,,2023,https://papers.nips.cc/paper_files/paper/2023/file/056e8e9c8ca9929cb6cf198952bf1dbb-Paper-Conference.pdf,F:\neurips_papers_python\2023\What You See is What You Read_ Improving Text-Image Alignment Evaluation.pdf
Stochastic Distributed Optimization under Average Second-order Similarity: Algorithms and Analysis,,2023,https://papers.nips.cc/paper_files/paper/2023/file/05e552739c2629f3324c1063a382b4bd-Paper-Conference.pdf,F:\neurips_papers_python\2023\Stochastic Distributed Optimization under Average Second-order Similarity_ Algorithms and Analysis.pdf
Rethinking the Backward Propagation for Adversarial Transferability,,2023,https://papers.nips.cc/paper_files/paper/2023/file/05fe0c633ae41756540dba2a99a36306-Paper-Conference.pdf,F:\neurips_papers_python\2023\Rethinking the Backward Propagation for Adversarial Transferability.pdf
Can You Rely on Your Model Evaluation? Improving Model Evaluation with Synthetic Test Data,,2023,https://papers.nips.cc/paper_files/paper/2023/file/05fb0f4e645cad23e0ab59d6b9901428-Paper-Conference.pdf,F:\neurips_papers_python\2023\Can You Rely on Your Model Evaluation_ Improving Model Evaluation with Synthetic Test Data.pdf
Collaborative Learning via Prediction Consensus,,2023,https://papers.nips.cc/paper_files/paper/2023/file/065e259a1d2d955e63b99aac6a3a3081-Paper-Conference.pdf,F:\neurips_papers_python\2023\Collaborative Learning via Prediction Consensus.pdf
Identification of Nonlinear Latent Hierarchical Models,,2023,https://papers.nips.cc/paper_files/paper/2023/file/065ef23a944b3995de7dd4a3e203d133-Paper-Conference.pdf,F:\neurips_papers_python\2023\Identification of Nonlinear Latent Hierarchical Models.pdf
Sample Efficient Reinforcement Learning in Mixed Systems through Augmented Samples and Its Applications to Queueing Networks,,2023,https://papers.nips.cc/paper_files/paper/2023/file/0663a39baab211328fc865f91abc75ab-Paper-Conference.pdf,F:\neurips_papers_python\2023\Sample Efficient Reinforcement Learning in Mixed Systems through Augmented Samples and Its Applications to Queueing Networks.pdf
Towards Unbounded Machine Unlearning,,2023,https://papers.nips.cc/paper_files/paper/2023/file/062d711fb777322e2152435459e6e9d9-Paper-Conference.pdf,F:\neurips_papers_python\2023\Towards Unbounded Machine Unlearning.pdf
