Title,Authors,Year,PDF URL,File Path
Efficient Equivariant Transfer Learning from Pretrained Models,,2023,https://papers.nips.cc/paper_files/paper/2023/file/0d02892a0055c94584f6394f8d069c8e-Paper-Conference.pdf,F:\neurips_papers_python\2023\Efficient Equivariant Transfer Learning from Pretrained Models.pdf
$H$-Consistency Bounds: Characterization and Extensions,,2023,https://papers.nips.cc/paper_files/paper/2023/file/0e441913d4fa486c3eec967d79750b13-Paper-Conference.pdf,F:\neurips_papers_python\2023\$H$-Consistency Bounds_ Characterization and Extensions.pdf
Direction-oriented Multi-objective Learning: Simple and Provable Stochastic Algorithms,,2023,https://papers.nips.cc/paper_files/paper/2023/file/0e5b96f97c1813bb75f6c28532c2ecc7-Paper-Conference.pdf,F:\neurips_papers_python\2023\Direction-oriented Multi-objective Learning_ Simple and Provable Stochastic Algorithms.pdf
Exploiting Correlated Auxiliary Feedback in Parameterized Bandits,,2023,https://papers.nips.cc/paper_files/paper/2023/file/0e0157ce5ea15831072be4744cbd5334-Paper-Conference.pdf,F:\neurips_papers_python\2023\Exploiting Correlated Auxiliary Feedback in Parameterized Bandits.pdf
Counting Distinct Elements in the Turnstile Model with Differential Privacy under Continual Observation,,2023,https://papers.nips.cc/paper_files/paper/2023/file/0ef1afa0daa888d695dcd5e9513bafa3-Paper-Conference.pdf,F:\neurips_papers_python\2023\Counting Distinct Elements in the Turnstile Model with Differential Privacy under Continual Observation.pdf
Where2Explore: Few-shot Affordance Learning for Unseen Novel Categories of Articulated Objects,,2023,https://papers.nips.cc/paper_files/paper/2023/file/0e7e2af2e5ba822c9ad35a37b31b5dd4-Paper-Conference.pdf,F:\neurips_papers_python\2023\Where2Explore_ Few-shot Affordance Learning for Unseen Novel Categories of Articulated Objects.pdf
Demystifying Softmax Gating Function in Gaussian Mixture of Experts,,2023,https://papers.nips.cc/paper_files/paper/2023/file/0ef6ffcb85a2d238fc4761860c31ded4-Paper-Conference.pdf,F:\neurips_papers_python\2023\Demystifying Softmax Gating Function in Gaussian Mixture of Experts.pdf
Hybrid Policy Optimization from Imperfect Demonstrations,,2023,https://papers.nips.cc/paper_files/paper/2023/file/0f0a30c7b46be23a83317c5cb721fc43-Paper-Conference.pdf,F:\neurips_papers_python\2023\Hybrid Policy Optimization from Imperfect Demonstrations.pdf
What is Flagged in Uncertainty Quantification?  Latent Density Models for Uncertainty Categorization,,2023,https://papers.nips.cc/paper_files/paper/2023/file/0f0c4f3d83c58df58380af3b0729354c-Paper-Conference.pdf,F:\neurips_papers_python\2023\What is Flagged in Uncertainty Quantification_  Latent Density Models for Uncertainty Categorization.pdf
Efficient Data Subset Selection to Generalize Training Across Models: Transductive and Inductive Networks,,2023,https://papers.nips.cc/paper_files/paper/2023/file/0f25eb6e9dc26c933a5d7516abf1eb8c-Paper-Conference.pdf,F:\neurips_papers_python\2023\Efficient Data Subset Selection to Generalize Training Across Models_ Transductive and Inductive Networks.pdf
$SE(3)$  Equivariant Convolution and Transformer in Ray Space,,2023,https://papers.nips.cc/paper_files/paper/2023/file/075b2875e2b671ddd74aeec0ac9f0357-Paper-Conference.pdf,F:\neurips_papers_python\2023\$SE(3)$  Equivariant Convolution and Transformer in Ray Space.pdf
A Theoretical Analysis of the Test Error of Finite-Rank Kernel Ridge Regression,,2023,https://papers.nips.cc/paper_files/paper/2023/file/0f580c1ace3b857a390575ca42de7938-Paper-Conference.pdf,F:\neurips_papers_python\2023\A Theoretical Analysis of the Test Error of Finite-Rank Kernel Ridge Regression.pdf
HiBug: On Human-Interpretable Model Debug,,2023,https://papers.nips.cc/paper_files/paper/2023/file/0f53ecc0d36a5d5d3d3e94d42c4b23ca-Paper-Conference.pdf,F:\neurips_papers_python\2023\HiBug_ On Human-Interpretable Model Debug.pdf
Conformalized matrix completion,,2023,https://papers.nips.cc/paper_files/paper/2023/file/0f7e4bb7a35dd4cb426203c91a4bfa10-Paper-Conference.pdf,F:\neurips_papers_python\2023\Conformalized matrix completion.pdf
Mixture Weight Estimation and Model Prediction in Multi-source Multi-target Domain Adaptation,,2023,https://papers.nips.cc/paper_files/paper/2023/file/0fa81c3f0d57f95b8776de3a248ef0ed-Paper-Conference.pdf,F:\neurips_papers_python\2023\Mixture Weight Estimation and Model Prediction in Multi-source Multi-target Domain Adaptation.pdf
Learning Domain-Aware Detection Head with Prompt Tuning,,2023,https://papers.nips.cc/paper_files/paper/2023/file/0d18ab3b5fabfa6fe47c62e711af02f0-Paper-Conference.pdf,F:\neurips_papers_python\2023\Learning Domain-Aware Detection Head with Prompt Tuning.pdf
CBD: A Certified Backdoor Detector Based on Local Dominant Probability,,2023,https://papers.nips.cc/paper_files/paper/2023/file/0fbf046448d7eea18b982001320b9a10-Paper-Conference.pdf,F:\neurips_papers_python\2023\CBD_ A Certified Backdoor Detector Based on Local Dominant Probability.pdf
Multi-modal Queried Object Detection in the Wild,,2023,https://papers.nips.cc/paper_files/paper/2023/file/0e3af444e7d82d29871804de476d1fbe-Paper-Conference.pdf,F:\neurips_papers_python\2023\Multi-modal Queried Object Detection in the Wild.pdf
Beyond Uniform Sampling: Offline Reinforcement Learning with Imbalanced Datasets,,2023,https://papers.nips.cc/paper_files/paper/2023/file/0ff3502bb29570b219967278db150a50-Paper-Conference.pdf,F:\neurips_papers_python\2023\Beyond Uniform Sampling_ Offline Reinforcement Learning with Imbalanced Datasets.pdf
Variational Weighting for Kernel Density Ratios,,2023,https://papers.nips.cc/paper_files/paper/2023/file/0ff54b4ec4f70b3ae12c8621ca8a49f4-Paper-Conference.pdf,F:\neurips_papers_python\2023\Variational Weighting for Kernel Density Ratios.pdf
SheetCopilot: Bringing Software Productivity to the Next Level through Large Language Models,,2023,https://papers.nips.cc/paper_files/paper/2023/file/0ff30c4bf31db0119a6219e0d250e037-Paper-Conference.pdf,F:\neurips_papers_python\2023\SheetCopilot_ Bringing Software Productivity to the Next Level through Large Language Models.pdf
HeadSculpt: Crafting 3D Head Avatars with Text,,2023,https://papers.nips.cc/paper_files/paper/2023/file/0fb98d483fa580e0354bcdd3a003a3f3-Paper-Conference.pdf,F:\neurips_papers_python\2023\HeadSculpt_ Crafting 3D Head Avatars with Text.pdf
Meet in the Middle: A New Pre-training Paradigm,,2023,https://papers.nips.cc/paper_files/paper/2023/file/105fdc31cc9eb927cc5a0110f4031287-Paper-Conference.pdf,F:\neurips_papers_python\2023\Meet in the Middle_ A New Pre-training Paradigm.pdf
DreamWaltz: Make a Scene with Complex 3D Animatable Avatars,,2023,https://papers.nips.cc/paper_files/paper/2023/file/0e769ec2c2cd99b6ad69c9d75113e386-Paper-Conference.pdf,F:\neurips_papers_python\2023\DreamWaltz_ Make a Scene with Complex 3D Animatable Avatars.pdf
Complexity of Derivative-Free Policy Optimization for Structured $\mathcal{H}_\infty$ Control,,2023,https://papers.nips.cc/paper_files/paper/2023/file/1052b823a161aa2c808dd51c0f58dc37-Paper-Conference.pdf,F:\neurips_papers_python\2023\Complexity of Derivative-Free Policy Optimization for Structured $_mathcal{H}__infty$ Control.pdf
Adversarial Examples Exist in Two-Layer ReLU Networks for Low Dimensional Linear Subspaces,,2023,https://papers.nips.cc/paper_files/paper/2023/file/0ffd11b5bce666816802b86c77b54cf7-Paper-Conference.pdf,F:\neurips_papers_python\2023\Adversarial Examples Exist in Two-Layer ReLU Networks for Low Dimensional Linear Subspaces.pdf
Exposing flaws of generative model evaluation metrics and their unfair treatment of diffusion models,,2023,https://papers.nips.cc/paper_files/paper/2023/file/0bc795afae289ed465a65a3b4b1f4eb7-Paper-Conference.pdf,F:\neurips_papers_python\2023\Exposing flaws of generative model evaluation metrics and their unfair treatment of diffusion models.pdf
Adversarially Robust Learning with Uncertain Perturbation Sets,,2023,https://papers.nips.cc/paper_files/paper/2023/file/1097a0aeaf00cacfa8f6aced24f3a8bd-Paper-Conference.pdf,F:\neurips_papers_python\2023\Adversarially Robust Learning with Uncertain Perturbation Sets.pdf
DDCoT: Duty-Distinct Chain-of-Thought Prompting for Multimodal Reasoning in Language Models,,2023,https://papers.nips.cc/paper_files/paper/2023/file/108030643e640ac050e0ed5e6aace48f-Paper-Conference.pdf,F:\neurips_papers_python\2023\DDCoT_ Duty-Distinct Chain-of-Thought Prompting for Multimodal Reasoning in Language Models.pdf
Common Ground in Cooperative Communication,,2023,https://papers.nips.cc/paper_files/paper/2023/file/10b7e27c8eb9571fbbd2ae6a9f8c3855-Paper-Conference.pdf,F:\neurips_papers_python\2023\Common Ground in Cooperative Communication.pdf
ConRad: Image Constrained Radiance Fields for 3D Generation from a Single Image,,2023,https://papers.nips.cc/paper_files/paper/2023/file/0b68d474baf8dff30f3280c199a32089-Paper-Conference.pdf,F:\neurips_papers_python\2023\ConRad_ Image Constrained Radiance Fields for 3D Generation from a Single Image.pdf
GlucoSynth: Generating Differentially-Private Synthetic Glucose Traces,,2023,https://papers.nips.cc/paper_files/paper/2023/file/0ab51646ca369140c3c3ece011b66587-Paper-Conference.pdf,F:\neurips_papers_python\2023\GlucoSynth_ Generating Differentially-Private Synthetic Glucose Traces.pdf
Keep Various Trajectories: Promoting Exploration of Ensemble Policies in Continuous Control,,2023,https://papers.nips.cc/paper_files/paper/2023/file/10cb15f4559b3d578b7f24966d48a137-Paper-Conference.pdf,F:\neurips_papers_python\2023\Keep Various Trajectories_ Promoting Exploration of Ensemble Policies in Continuous Control.pdf
ReSync: Riemannian Subgradient-based Robust Rotation Synchronization,,2023,https://papers.nips.cc/paper_files/paper/2023/file/10e9204f14c4daa08041343455435308-Paper-Conference.pdf,F:\neurips_papers_python\2023\ReSync_ Riemannian Subgradient-based Robust Rotation Synchronization.pdf
Non-Smooth Weakly-Convex Finite-sum Coupled Compositional Optimization,,2023,https://papers.nips.cc/paper_files/paper/2023/file/1160792eab11de2bbaf9e71fce191e8c-Paper-Conference.pdf,F:\neurips_papers_python\2023\Non-Smooth Weakly-Convex Finite-sum Coupled Compositional Optimization.pdf
Initialization Matters: Privacy-Utility Analysis of Overparameterized Neural Networks,,2023,https://papers.nips.cc/paper_files/paper/2023/file/1165af8b913fb836c6280b42d6e0084f-Paper-Conference.pdf,F:\neurips_papers_python\2023\Initialization Matters_ Privacy-Utility Analysis of Overparameterized Neural Networks.pdf
Learning Invariant Representations with a Nonparametric Nadaraya-Watson Head,,2023,https://papers.nips.cc/paper_files/paper/2023/file/0f6931a9e339a012a9909306d7c758b4-Paper-Conference.pdf,F:\neurips_papers_python\2023\Learning Invariant Representations with a Nonparametric Nadaraya-Watson Head.pdf
Optimal Transport for Treatment Effect Estimation,,2023,https://papers.nips.cc/paper_files/paper/2023/file/1160e7f31d0a74abbbe1bbf7924b949c-Paper-Conference.pdf,F:\neurips_papers_python\2023\Optimal Transport for Treatment Effect Estimation.pdf
Cause-Effect Inference in Location-Scale Noise Models: Maximum Likelihood vs. Independence Testing,,2023,https://papers.nips.cc/paper_files/paper/2023/file/11715d433f6f8b9106baae0df023deb3-Paper-Conference.pdf,F:\neurips_papers_python\2023\Cause-Effect Inference in Location-Scale Noise Models_ Maximum Likelihood vs. Independence Testing.pdf
Neural Frailty Machine: Beyond proportional hazard assumption in neural survival regressions,,2023,https://papers.nips.cc/paper_files/paper/2023/file/11a7f429d75f9f8c6e9c630aeb6524b5-Paper-Conference.pdf,F:\neurips_papers_python\2023\Neural Frailty Machine_ Beyond proportional hazard assumption in neural survival regressions.pdf
Constrained Policy Optimization with Explicit Behavior Density For Offline Reinforcement Learning,,2023,https://papers.nips.cc/paper_files/paper/2023/file/11e1900e680f5fe1893a8e27362dbe2c-Paper-Conference.pdf,F:\neurips_papers_python\2023\Constrained Policy Optimization with Explicit Behavior Density For Offline Reinforcement Learning.pdf
Non-autoregressive Machine Translation with Probabilistic Context-free Grammar,,2023,https://papers.nips.cc/paper_files/paper/2023/file/11c7f1dd168439884b6dfb43a7891432-Paper-Conference.pdf,F:\neurips_papers_python\2023\Non-autoregressive Machine Translation with Probabilistic Context-free Grammar.pdf
Formalizing locality for normative synaptic plasticity models,,2023,https://papers.nips.cc/paper_files/paper/2023/file/120339238f293d4ae53a7167403abc4b-Paper-Conference.pdf,F:\neurips_papers_python\2023\Formalizing locality for normative synaptic plasticity models.pdf
Exact Verification of ReLU Neural Control Barrier Functions,,2023,https://papers.nips.cc/paper_files/paper/2023/file/120ed726cf129dbeb8375b6f8a0686f8-Paper-Conference.pdf,F:\neurips_papers_python\2023\Exact Verification of ReLU Neural Control Barrier Functions.pdf
Normalization-Equivariant Neural Networks with Application to Image Denoising,,2023,https://papers.nips.cc/paper_files/paper/2023/file/12143893d9d37c3569dda800b95cabd9-Paper-Conference.pdf,F:\neurips_papers_python\2023\Normalization-Equivariant Neural Networks with Application to Image Denoising.pdf
Federated Conditional Stochastic Optimization,,2023,https://papers.nips.cc/paper_files/paper/2023/file/1229eaae5bf1db93e1e4c539258eb472-Paper-Conference.pdf,F:\neurips_papers_python\2023\Federated Conditional Stochastic Optimization.pdf
Budgeting Counterfactual for Offline RL,,2023,https://papers.nips.cc/paper_files/paper/2023/file/121db870b0470dd63bb5bc59c724275a-Paper-Conference.pdf,F:\neurips_papers_python\2023\Budgeting Counterfactual for Offline RL.pdf
Fine-Grained Cross-View Geo-Localization Using a Correlation-Aware Homography Estimator,,2023,https://papers.nips.cc/paper_files/paper/2023/file/112d8e0c7563de6e3408b49a09b4d8a3-Paper-Conference.pdf,F:\neurips_papers_python\2023\Fine-Grained Cross-View Geo-Localization Using a Correlation-Aware Homography Estimator.pdf
On the Exploration of Local Significant Differences For Two-Sample Test,,2023,https://papers.nips.cc/paper_files/paper/2023/file/10fc83943b4540a9524af6fc67a23fef-Paper-Conference.pdf,F:\neurips_papers_python\2023\On the Exploration of Local Significant Differences For Two-Sample Test.pdf
Contextually Affinitive Neighborhood Refinery for Deep Clustering,,2023,https://papers.nips.cc/paper_files/paper/2023/file/123cfe7d8b7702ac97aaf4468fc05fa5-Paper-Conference.pdf,F:\neurips_papers_python\2023\Contextually Affinitive Neighborhood Refinery for Deep Clustering.pdf
LaFTer: Label-Free Tuning of Zero-shot Classifier using Language and Unlabeled Image Collections,,2023,https://papers.nips.cc/paper_files/paper/2023/file/123a18dfd821c8b440f42a00a27648d6-Paper-Conference.pdf,F:\neurips_papers_python\2023\LaFTer_ Label-Free Tuning of Zero-shot Classifier using Language and Unlabeled Image Collections.pdf
Don’t Stop Pretraining? Make Prompt-based Fine-tuning Powerful Learner,,2023,https://papers.nips.cc/paper_files/paper/2023/file/1289f9195d2ef8cfdfe5f50930c4a7c4-Paper-Conference.pdf,F:\neurips_papers_python\2023\Don’t Stop Pretraining_ Make Prompt-based Fine-tuning Powerful Learner.pdf
GEX: A flexible method for approximating influence via Geometric Ensemble,,2023,https://papers.nips.cc/paper_files/paper/2023/file/1297ca5c906f4bada8f5f6f4e80f9dd2-Paper-Conference.pdf,F:\neurips_papers_python\2023\GEX_ A flexible method for approximating influence via Geometric Ensemble.pdf
Score-based Source Separation with Applications to Digital Communication Signals,,2023,https://papers.nips.cc/paper_files/paper/2023/file/106b2434b8d496c6aed9235d478678af-Paper-Conference.pdf,F:\neurips_papers_python\2023\Score-based Source Separation with Applications to Digital Communication Signals.pdf
Offline Reinforcement Learning for Mixture-of-Expert Dialogue Management,,2023,https://papers.nips.cc/paper_files/paper/2023/file/12bcf58a1c09a0fcb5310f3589291ab4-Paper-Conference.pdf,F:\neurips_papers_python\2023\Offline Reinforcement Learning for Mixture-of-Expert Dialogue Management.pdf
Binary Classification with Confidence Difference,,2023,https://papers.nips.cc/paper_files/paper/2023/file/12c118ef87fde56a10bd858842781b34-Paper-Conference.pdf,F:\neurips_papers_python\2023\Binary Classification with Confidence Difference.pdf
CELLE-2: Translating Proteins to Pictures and Back with a Bidirectional Text-to-Image Transformer,,2023,https://papers.nips.cc/paper_files/paper/2023/file/0fb7c02d420c993385c7de44c2b5bf01-Paper-Conference.pdf,F:\neurips_papers_python\2023\CELLE-2_ Translating Proteins to Pictures and Back with a Bidirectional Text-to-Image Transformer.pdf
Resilient Multiple Choice Learning: A learned scoring scheme with application to audio scene analysis,,2023,https://papers.nips.cc/paper_files/paper/2023/file/12d7ba753894ed348904df1bf0ce02ec-Paper-Conference.pdf,F:\neurips_papers_python\2023\Resilient Multiple Choice Learning_ A learned scoring scheme with application to audio scene analysis.pdf
Graph of Circuits with GNN for Exploring the Optimal Design Space,,2023,https://papers.nips.cc/paper_files/paper/2023/file/12da92b7c64176eb6eb6ad0ae31554fd-Paper-Conference.pdf,F:\neurips_papers_python\2023\Graph of Circuits with GNN for Exploring the Optimal Design Space.pdf
Learning Shared Safety Constraints from Multi-task Demonstrations,,2023,https://papers.nips.cc/paper_files/paper/2023/file/124dde499d62b58e97e42a45b26d7369-Paper-Conference.pdf,F:\neurips_papers_python\2023\Learning Shared Safety Constraints from Multi-task Demonstrations.pdf
Auditing Fairness by Betting,,2023,https://papers.nips.cc/paper_files/paper/2023/file/1338c277525011f20166cf740952bb47-Paper-Conference.pdf,F:\neurips_papers_python\2023\Auditing Fairness by Betting.pdf
Structure-free Graph Condensation: From Large-scale Graphs to Condensed Graph-free Data,,2023,https://papers.nips.cc/paper_files/paper/2023/file/13183a224208671a6fc33ba1aa661ec4-Paper-Conference.pdf,F:\neurips_papers_python\2023\Structure-free Graph Condensation_ From Large-scale Graphs to Condensed Graph-free Data.pdf
GIMLET: A Unified Graph-Text Model for Instruction-Based Molecule Zero-Shot Learning,,2023,https://papers.nips.cc/paper_files/paper/2023/file/129033c7c08be683059559e8d6bfd460-Paper-Conference.pdf,F:\neurips_papers_python\2023\GIMLET_ A Unified Graph-Text Model for Instruction-Based Molecule Zero-Shot Learning.pdf
Information Maximization Perspective of Orthogonal Matching Pursuit with Applications to Explainable AI,,2023,https://papers.nips.cc/paper_files/paper/2023/file/08eac13583b310ec55d755f99c549be3-Paper-Conference.pdf,F:\neurips_papers_python\2023\Information Maximization Perspective of Orthogonal Matching Pursuit with Applications to Explainable AI.pdf
On the Implicit Bias of Linear Equivariant Steerable Networks,,2023,https://papers.nips.cc/paper_files/paper/2023/file/136a45cd9b841bf785625709a19c6508-Paper-Conference.pdf,F:\neurips_papers_python\2023\On the Implicit Bias of Linear Equivariant Steerable Networks.pdf
Truly Scale-Equivariant Deep Nets with Fourier Layers,,2023,https://papers.nips.cc/paper_files/paper/2023/file/1343edb2739a61a6e20bd8764e814b50-Paper-Conference.pdf,F:\neurips_papers_python\2023\Truly Scale-Equivariant Deep Nets with Fourier Layers.pdf
Memory-Constrained Algorithms for Convex Optimization,,2023,https://papers.nips.cc/paper_files/paper/2023/file/1395b425d06a50e42fafe91cf04f3a98-Paper-Conference.pdf,F:\neurips_papers_python\2023\Memory-Constrained Algorithms for Convex Optimization.pdf
CROMA: Remote Sensing Representations with Contrastive Radar-Optical Masked Autoencoders,,2023,https://papers.nips.cc/paper_files/paper/2023/file/11822e84689e631615199db3b75cd0e4-Paper-Conference.pdf,F:\neurips_papers_python\2023\CROMA_ Remote Sensing Representations with Contrastive Radar-Optical Masked Autoencoders.pdf
On student-teacher deviations in distillation: does it pay to disobey?,,2023,https://papers.nips.cc/paper_files/paper/2023/file/12d286282e1be5431ea05262a21f415c-Paper-Conference.pdf,F:\neurips_papers_python\2023\On student-teacher deviations in distillation_ does it pay to disobey_.pdf
Tracking Most Significant Shifts in Nonparametric Contextual Bandits,,2023,https://papers.nips.cc/paper_files/paper/2023/file/13b501c58ae3bfe9635a259f4414e943-Paper-Conference.pdf,F:\neurips_papers_python\2023\Tracking Most Significant Shifts in Nonparametric Contextual Bandits.pdf
Projection-Free Methods for Stochastic Simple Bilevel Optimization with Convex Lower-level Problem,,2023,https://papers.nips.cc/paper_files/paper/2023/file/136729ae4b0fee25a0d28077442506da-Paper-Conference.pdf,F:\neurips_papers_python\2023\Projection-Free Methods for Stochastic Simple Bilevel Optimization with Convex Lower-level Problem.pdf
Differentiable Blocks World: Qualitative 3D Decomposition by Rendering Primitives,,2023,https://papers.nips.cc/paper_files/paper/2023/file/123fd8a56501194823c8e0dca00733df-Paper-Conference.pdf,F:\neurips_papers_python\2023\Differentiable Blocks World_ Qualitative 3D Decomposition by Rendering Primitives.pdf
"The Rashomon Importance Distribution: Getting RID of Unstable, Single Model-based Variable Importance",,2023,https://papers.nips.cc/paper_files/paper/2023/file/1403ab1a427050538ec59c7f570aec8b-Paper-Conference.pdf,"F:\neurips_papers_python\2023\The Rashomon Importance Distribution_ Getting RID of Unstable, Single Model-based Variable Importance.pdf"
Empowering Collaborative Filtering with Principled Adversarial Contrastive Loss,,2023,https://papers.nips.cc/paper_files/paper/2023/file/13f1750b825659394a6499399e7637fc-Paper-Conference.pdf,F:\neurips_papers_python\2023\Empowering Collaborative Filtering with Principled Adversarial Contrastive Loss.pdf
Model-Based Control with Sparse Neural Dynamics,,2023,https://papers.nips.cc/paper_files/paper/2023/file/142cdba4b8d1e03f9ee131ac86bb0afc-Paper-Conference.pdf,F:\neurips_papers_python\2023\Model-Based Control with Sparse Neural Dynamics.pdf
Fair Streaming Principal Component Analysis: Statistical and Algorithmic Viewpoint,,2023,https://papers.nips.cc/paper_files/paper/2023/file/1074541383db5ef12d6ac66d2f8e8d34-Paper-Conference.pdf,F:\neurips_papers_python\2023\Fair Streaming Principal Component Analysis_ Statistical and Algorithmic Viewpoint.pdf
Provably Efficient Algorithm for Nonstationary Low-Rank MDPs,,2023,https://papers.nips.cc/paper_files/paper/2023/file/145c28cd4b1df9b426990fd68045f4f7-Paper-Conference.pdf,F:\neurips_papers_python\2023\Provably Efficient Algorithm for Nonstationary Low-Rank MDPs.pdf
Time-uniform confidence bands for the CDF under nonstationarity,,2023,https://papers.nips.cc/paper_files/paper/2023/file/148bbc25b934211d80435b5cad5a7198-Paper-Conference.pdf,F:\neurips_papers_python\2023\Time-uniform confidence bands for the CDF under nonstationarity.pdf
Visual Programming for Step-by-Step Text-to-Image Generation and Evaluation,,2023,https://papers.nips.cc/paper_files/paper/2023/file/13250eb13871b3c2c0a0667b54bad165-Paper-Conference.pdf,F:\neurips_papers_python\2023\Visual Programming for Step-by-Step Text-to-Image Generation and Evaluation.pdf
AmadeusGPT: a natural language interface for interactive animal behavioral analysis,,2023,https://papers.nips.cc/paper_files/paper/2023/file/1456560769bbc38e4f8c5055048ea712-Paper-Conference.pdf,F:\neurips_papers_python\2023\AmadeusGPT_ a natural language interface for interactive animal behavioral analysis.pdf
Risk-Averse Active Sensing for Timely Outcome Prediction under Cost Pressure,,2023,https://papers.nips.cc/paper_files/paper/2023/file/1498a03a04f9bcd3a7d44058fc5dc639-Paper-Conference.pdf,F:\neurips_papers_python\2023\Risk-Averse Active Sensing for Timely Outcome Prediction under Cost Pressure.pdf
Single-Pass Pivot Algorithm for Correlation Clustering. Keep it simple!,,2023,https://papers.nips.cc/paper_files/paper/2023/file/149ad6e32c08b73a3ecc3d11977fcc47-Paper-Conference.pdf,F:\neurips_papers_python\2023\Single-Pass Pivot Algorithm for Correlation Clustering. Keep it simple!.pdf
SPACE: Single-round Participant Amalgamation for Contribution Evaluation in Federated Learning,,2023,https://papers.nips.cc/paper_files/paper/2023/file/14a812fa4b6bf244d055e37a7cd2f557-Paper-Conference.pdf,F:\neurips_papers_python\2023\SPACE_ Single-round Participant Amalgamation for Contribution Evaluation in Federated Learning.pdf
"Federated Learning with Client Subsampling, Data Heterogeneity, and Unbounded Smoothness: A New Algorithm and Lower Bounds",,2023,https://papers.nips.cc/paper_files/paper/2023/file/14ecbfb2216bab76195b60bfac7efb1f-Paper-Conference.pdf,"F:\neurips_papers_python\2023\Federated Learning with Client Subsampling, Data Heterogeneity, and Unbounded Smoothness_ A New Algorithm and Lower Bounds.pdf"
Spectral Invariant Learning for Dynamic Graphs under Distribution Shifts,,2023,https://papers.nips.cc/paper_files/paper/2023/file/154b90fcc9ba3dee96779c05c3108908-Paper-Conference.pdf,F:\neurips_papers_python\2023\Spectral Invariant Learning for Dynamic Graphs under Distribution Shifts.pdf
Quantifying the Cost of Learning in Queueing Systems,,2023,https://papers.nips.cc/paper_files/paper/2023/file/1502957929fc4257dd1b6daf7d869c2f-Paper-Conference.pdf,F:\neurips_papers_python\2023\Quantifying the Cost of Learning in Queueing Systems.pdf
Data Market Design through Deep Learning,,2023,https://papers.nips.cc/paper_files/paper/2023/file/1577ea3eaf8dacb99f64e4496c3ecddf-Paper-Conference.pdf,F:\neurips_papers_python\2023\Data Market Design through Deep Learning.pdf
FeCAM: Exploiting the Heterogeneity of Class Distributions in Exemplar-Free Continual Learning,,2023,https://papers.nips.cc/paper_files/paper/2023/file/15294ba2dcfb4521274f7aa1c26f4dd4-Paper-Conference.pdf,F:\neurips_papers_python\2023\FeCAM_ Exploiting the Heterogeneity of Class Distributions in Exemplar-Free Continual Learning.pdf
