Title,Authors,Year,PDF URL,File Path
Toward a realistic model of speech processing in the brain with self-supervised learning,,2022,https://papers.nips.cc/paper_files/paper/2022/file/d81ecfc8fb18e833a3fa0a35d92532b8-Paper-Conference.pdf,F:\neurips_papers_python\2022\Toward a realistic model of speech processing in the brain with self-supervised learning.pdf
Optimal Gradient Sliding and its Application to Optimal Distributed Optimization Under Similarity,,2022,https://papers.nips.cc/paper_files/paper/2022/file/d88f6f81e1aaf606776ffdd06fdf24ef-Paper-Conference.pdf,F:\neurips_papers_python\2022\Optimal Gradient Sliding and its Application to Optimal Distributed Optimization Under Similarity.pdf
Universally Expressive Communication in Multi-Agent Reinforcement Learning,,2022,https://papers.nips.cc/paper_files/paper/2022/file/d8a19c815a8bef25e6094e87f963d28e-Paper-Conference.pdf,F:\neurips_papers_python\2022\Universally Expressive Communication in Multi-Agent Reinforcement Learning.pdf
Provably sample-efficient RL with side information about latent dynamics,,2022,https://papers.nips.cc/paper_files/paper/2022/file/d8684e49752e06ac5e4b554b60ad212a-Paper-Conference.pdf,F:\neurips_papers_python\2022\Provably sample-efficient RL with side information about latent dynamics.pdf
Fast Stochastic Composite Minimization and an Accelerated Frank-Wolfe Algorithm under Parallelization,,2022,https://papers.nips.cc/paper_files/paper/2022/file/d903c4bb4e77f5de1ec92da2cf9dc8db-Paper-Conference.pdf,F:\neurips_papers_python\2022\Fast Stochastic Composite Minimization and an Accelerated Frank-Wolfe Algorithm under Parallelization.pdf
Stability and Generalization of Kernel Clustering: from Single Kernel to Multiple Kernel,,2022,https://papers.nips.cc/paper_files/paper/2022/file/da0945c639b376b84941256c7371dd45-Paper-Conference.pdf,F:\neurips_papers_python\2022\Stability and Generalization of Kernel Clustering_ from Single Kernel to Multiple Kernel.pdf
The least-control principle for local learning at equilibrium,,2022,https://papers.nips.cc/paper_files/paper/2022/file/d9c7c8bd6ad4cebb7d006e5109e0b682-Paper-Conference.pdf,F:\neurips_papers_python\2022\The least-control principle for local learning at equilibrium.pdf
Random Normalization Aggregation for Adversarial Defense,,2022,https://papers.nips.cc/paper_files/paper/2022/file/da3d4d2e9b37f78ec3e7d0428c9b819a-Paper-Conference.pdf,F:\neurips_papers_python\2022\Random Normalization Aggregation for Adversarial Defense.pdf
VICE: Variational Interpretable Concept Embeddings,,2022,https://papers.nips.cc/paper_files/paper/2022/file/da1a97b53eec1c763c6d06835538fe3e-Paper-Conference.pdf,F:\neurips_papers_python\2022\VICE_ Variational Interpretable Concept Embeddings.pdf
Near-Optimal Correlation Clustering with Privacy,,2022,https://papers.nips.cc/paper_files/paper/2022/file/da645920dcd3bd35b0dae329894bad80-Paper-Conference.pdf,F:\neurips_papers_python\2022\Near-Optimal Correlation Clustering with Privacy.pdf
Knowledge Distillation from A Stronger Teacher,,2022,https://papers.nips.cc/paper_files/paper/2022/file/da669dfd3c36c93905a17ddba01eef06-Paper-Conference.pdf,F:\neurips_papers_python\2022\Knowledge Distillation from A Stronger Teacher.pdf
Optimal Transport of Classifiers to Fairness,,2022,https://papers.nips.cc/paper_files/paper/2022/file/da75d2bbf862b86f10241d0887613b41-Paper-Conference.pdf,F:\neurips_papers_python\2022\Optimal Transport of Classifiers to Fairness.pdf
A Unifying Framework for Online Optimization with Long-Term Constraints,,2022,https://papers.nips.cc/paper_files/paper/2022/file/d9b564716709357b4bccec9fc9ad04d2-Paper-Conference.pdf,F:\neurips_papers_python\2022\A Unifying Framework for Online Optimization with Long-Term Constraints.pdf
Rethinking the compositionality of point clouds through regularization in the hyperbolic space,,2022,https://papers.nips.cc/paper_files/paper/2022/file/da8f9fc2b555d122369f36a9684415c1-Paper-Conference.pdf,F:\neurips_papers_python\2022\Rethinking the compositionality of point clouds through regularization in the hyperbolic space.pdf
A Simple and Optimal Policy Design for Online Learning with Safety against Heavy-tailed Risk,,2022,https://papers.nips.cc/paper_files/paper/2022/file/dae8afc6b990aa0b3b5efaa096fbd7fa-Paper-Conference.pdf,F:\neurips_papers_python\2022\A Simple and Optimal Policy Design for Online Learning with Safety against Heavy-tailed Risk.pdf
Distributionally Robust Optimization with Data Geometry,,2022,https://papers.nips.cc/paper_files/paper/2022/file/da535999561b932f56efdd559498282e-Paper-Conference.pdf,F:\neurips_papers_python\2022\Distributionally Robust Optimization with Data Geometry.pdf
A Boosting Approach to Reinforcement Learning,,2022,https://papers.nips.cc/paper_files/paper/2022/file/daf8364f0715a41a469c677c0adc4754-Paper-Conference.pdf,F:\neurips_papers_python\2022\A Boosting Approach to Reinforcement Learning.pdf
Relaxing Equivariance Constraints with Non-stationary Continuous Filters,,2022,https://papers.nips.cc/paper_files/paper/2022/file/dafd116ac8c735f149558b79fd48e090-Paper-Conference.pdf,F:\neurips_papers_python\2022\Relaxing Equivariance Constraints with Non-stationary Continuous Filters.pdf
The Franz-Parisi Criterion and Computational Trade-offs in High Dimensional Statistics,,2022,https://papers.nips.cc/paper_files/paper/2022/file/daff682411a64632e083b9d6665b1d30-Paper-Conference.pdf,F:\neurips_papers_python\2022\The Franz-Parisi Criterion and Computational Trade-offs in High Dimensional Statistics.pdf
Why do We Need Large Batchsizes in Contrastive Learning? A Gradient-Bias Perspective,,2022,https://papers.nips.cc/paper_files/paper/2022/file/db174d373133dcc6bf83bc98e4b681f8-Paper-Conference.pdf,F:\neurips_papers_python\2022\Why do We Need Large Batchsizes in Contrastive Learning_ A Gradient-Bias Perspective.pdf
Oscillatory Tracking of Continuous Attractor Neural Networks Account for Phase Precession and Procession of Hippocampal Place Cells,,2022,https://papers.nips.cc/paper_files/paper/2022/file/d6797a91df19b768409b5178642dcb26-Paper-Conference.pdf,F:\neurips_papers_python\2022\Oscillatory Tracking of Continuous Attractor Neural Networks Account for Phase Precession and Procession of Hippocampal Place Cells.pdf
Structural Analysis of Branch-and-Cut and the Learnability of Gomory Mixed Integer Cuts,,2022,https://papers.nips.cc/paper_files/paper/2022/file/db2cbf43a349bc866111e791b58c7bf4-Paper-Conference.pdf,F:\neurips_papers_python\2022\Structural Analysis of Branch-and-Cut and the Learnability of Gomory Mixed Integer Cuts.pdf
Robust Neural Posterior Estimation and Statistical Model Criticism,,2022,https://papers.nips.cc/paper_files/paper/2022/file/db0eac6747e3631eb91095cd76065611-Paper-Conference.pdf,F:\neurips_papers_python\2022\Robust Neural Posterior Estimation and Statistical Model Criticism.pdf
Randomized Channel Shuffling: Minimal-Overhead Backdoor Attack Detection without Clean Datasets,,2022,https://papers.nips.cc/paper_files/paper/2022/file/db1d5c63576587fc1d40d33a75190c71-Paper-Conference.pdf,F:\neurips_papers_python\2022\Randomized Channel Shuffling_ Minimal-Overhead Backdoor Attack Detection without Clean Datasets.pdf
Finite-Time Last-Iterate Convergence for Learning in Multi-Player Games,,2022,https://papers.nips.cc/paper_files/paper/2022/file/db2d2001f63e83214b08948b459f69f0-Paper-Conference.pdf,F:\neurips_papers_python\2022\Finite-Time Last-Iterate Convergence for Learning in Multi-Player Games.pdf
Optimizing Relevance Maps of Vision Transformers Improves Robustness,,2022,https://papers.nips.cc/paper_files/paper/2022/file/d9fa720cf96f7c18ac4d9e04270f0bbf-Paper-Conference.pdf,F:\neurips_papers_python\2022\Optimizing Relevance Maps of Vision Transformers Improves Robustness.pdf
When are Local Queries Useful for Robust Learning?,,2022,https://papers.nips.cc/paper_files/paper/2022/file/db6461eaf0eaeaad1d9c4a70e4818cbd-Paper-Conference.pdf,F:\neurips_papers_python\2022\When are Local Queries Useful for Robust Learning_.pdf
Improving Intrinsic Exploration with Language Abstractions,,2022,https://papers.nips.cc/paper_files/paper/2022/file/db8cf88ced2536017980998929ee0fdf-Paper-Conference.pdf,F:\neurips_papers_python\2022\Improving Intrinsic Exploration with Language Abstractions.pdf
The trade-offs of model size in large recommendation models : 100GB to 10MB Criteo-tb DLRM model,,2022,https://papers.nips.cc/paper_files/paper/2022/file/dbae915128892556134f1c5375855590-Paper-Conference.pdf,F:\neurips_papers_python\2022\The trade-offs of model size in large recommendation models _ 100GB to 10MB Criteo-tb DLRM model.pdf
Near-Optimal Goal-Oriented Reinforcement Learning in Non-Stationary Environments,,2022,https://papers.nips.cc/paper_files/paper/2022/file/dbb5180957513805ebeea787b8c66ac9-Paper-Conference.pdf,F:\neurips_papers_python\2022\Near-Optimal Goal-Oriented Reinforcement Learning in Non-Stationary Environments.pdf
Bridging the Gap between Object and Image-level Representations for Open-Vocabulary Detection,,2022,https://papers.nips.cc/paper_files/paper/2022/file/dabf612543b97ea9c8f46d058d33cf74-Paper-Conference.pdf,F:\neurips_papers_python\2022\Bridging the Gap between Object and Image-level Representations for Open-Vocabulary Detection.pdf
Sparse Hypergraph Community Detection Thresholds in Stochastic Block Model,,2022,https://papers.nips.cc/paper_files/paper/2022/file/dbdea7859f1d2fc10f2c9e79b8f5ae54-Paper-Conference.pdf,F:\neurips_papers_python\2022\Sparse Hypergraph Community Detection Thresholds in Stochastic Block Model.pdf
A Unified Framework for Deep Symbolic Regression,,2022,https://papers.nips.cc/paper_files/paper/2022/file/dbca58f35bddc6e4003b2dd80e42f838-Paper-Conference.pdf,F:\neurips_papers_python\2022\A Unified Framework for Deep Symbolic Regression.pdf
ReCo: Retrieve and Co-segment for Zero-shot Transfer,,2022,https://papers.nips.cc/paper_files/paper/2022/file/daabe43c3e1d06980aa23880bfbe1f45-Paper-Conference.pdf,F:\neurips_papers_python\2022\ReCo_ Retrieve and Co-segment for Zero-shot Transfer.pdf
Understanding Non-linearity in Graph Neural Networks from the Bayesian-Inference Perspective,,2022,https://papers.nips.cc/paper_files/paper/2022/file/dbe0e575e4604367a989e850c9b28401-Paper-Conference.pdf,F:\neurips_papers_python\2022\Understanding Non-linearity in Graph Neural Networks from the Bayesian-Inference Perspective.pdf
Real-Valued Backpropagation is Unsuitable for Complex-Valued Neural Networks,,2022,https://papers.nips.cc/paper_files/paper/2022/file/dc06d4d2792265fb5454a6092bfd5c6a-Paper-Conference.pdf,F:\neurips_papers_python\2022\Real-Valued Backpropagation is Unsuitable for Complex-Valued Neural Networks.pdf
SPoVT: Semantic-Prototype Variational Transformer for Dense Point Cloud Semantic Completion,,2022,https://papers.nips.cc/paper_files/paper/2022/file/db6caae0f83e45e454e2215f07e7c5af-Paper-Conference.pdf,F:\neurips_papers_python\2022\SPoVT_ Semantic-Prototype Variational Transformer for Dense Point Cloud Semantic Completion.pdf
Explainable Reinforcement Learning via Model Transforms,,2022,https://papers.nips.cc/paper_files/paper/2022/file/dbef234be68d8b170240511639610fd1-Paper-Conference.pdf,F:\neurips_papers_python\2022\Explainable Reinforcement Learning via Model Transforms.pdf
Learning dynamics of deep linear networks with multiple pathways,,2022,https://papers.nips.cc/paper_files/paper/2022/file/dc3ca8bcd613e43ce540352b58d55d6d-Paper-Conference.pdf,F:\neurips_papers_python\2022\Learning dynamics of deep linear networks with multiple pathways.pdf
Self-Supervised Aggregation of Diverse Experts for Test-Agnostic Long-Tailed Recognition,,2022,https://papers.nips.cc/paper_files/paper/2022/file/dc6319dde4fb182b22fb902da9418566-Paper-Conference.pdf,F:\neurips_papers_python\2022\Self-Supervised Aggregation of Diverse Experts for Test-Agnostic Long-Tailed Recognition.pdf
"A Practical, Progressively-Expressive GNN",,2022,https://papers.nips.cc/paper_files/paper/2022/file/dc89a0709f213fd0ac4b1172719b2c38-Paper-Conference.pdf,"F:\neurips_papers_python\2022\A Practical, Progressively-Expressive GNN.pdf"
On Learning Fairness and Accuracy on Multiple Subgroups,,2022,https://papers.nips.cc/paper_files/paper/2022/file/dc96134e169de5aea1ba1fc34dfb8419-Paper-Conference.pdf,F:\neurips_papers_python\2022\On Learning Fairness and Accuracy on Multiple Subgroups.pdf
Adv-Attribute: Inconspicuous and Transferable Adversarial Attack on Face Recognition,,2022,https://papers.nips.cc/paper_files/paper/2022/file/dccbeb7a8df3065c4646928985edf435-Paper-Conference.pdf,F:\neurips_papers_python\2022\Adv-Attribute_ Inconspicuous and Transferable Adversarial Attack on Face Recognition.pdf
Black-box coreset variational inference,,2022,https://papers.nips.cc/paper_files/paper/2022/file/dce5d66bf88b7b7d0f11fbd9c9f16620-Paper-Conference.pdf,F:\neurips_papers_python\2022\Black-box coreset variational inference.pdf
Distilling Representations from GAN Generator via Squeeze and Span,,2022,https://papers.nips.cc/paper_files/paper/2022/file/dd0151081b1e80e93f1b8aaf0b684c18-Paper-Conference.pdf,F:\neurips_papers_python\2022\Distilling Representations from GAN Generator via Squeeze and Span.pdf
AutoMTL: A Programming Framework for Automating Efficient Multi-Task Learning,,2022,https://papers.nips.cc/paper_files/paper/2022/file/dd3bd4e35cdd224ed2153a996f41077f-Paper-Conference.pdf,F:\neurips_papers_python\2022\AutoMTL_ A Programming Framework for Automating Efficient Multi-Task Learning.pdf
A Quantitative Geometric Approach to Neural-Network Smoothness,,2022,https://papers.nips.cc/paper_files/paper/2022/file/dd1322ce23cbbdd9d7ebb0ad1223c27a-Paper-Conference.pdf,F:\neurips_papers_python\2022\A Quantitative Geometric Approach to Neural-Network Smoothness.pdf
Log-Concave and Multivariate Canonical Noise Distributions for Differential Privacy,,2022,https://papers.nips.cc/paper_files/paper/2022/file/dd73933d99ccd7ffe2306adb95ec5d02-Paper-Conference.pdf,F:\neurips_papers_python\2022\Log-Concave and Multivariate Canonical Noise Distributions for Differential Privacy.pdf
On the generalization of learning algorithms that do not converge,,2022,https://papers.nips.cc/paper_files/paper/2022/file/dd73f39426a03131c38c8d943153d44b-Paper-Conference.pdf,F:\neurips_papers_python\2022\On the generalization of learning algorithms that do not converge.pdf
Visual correspondence-based explanations improve AI robustness and human-AI team accuracy,,2022,https://papers.nips.cc/paper_files/paper/2022/file/ddb8486bf9ee0fdeca1866a13a96e98e-Paper-Conference.pdf,F:\neurips_papers_python\2022\Visual correspondence-based explanations improve AI robustness and human-AI team accuracy.pdf
Self-Supervised Learning via Maximum Entropy Coding,,2022,https://papers.nips.cc/paper_files/paper/2022/file/dc709714c52b35f2f34aca2a92b06bc8-Paper-Conference.pdf,F:\neurips_papers_python\2022\Self-Supervised Learning via Maximum Entropy Coding.pdf
Leveraging Factored Action Spaces for Efficient Offline Reinforcement Learning in Healthcare,,2022,https://papers.nips.cc/paper_files/paper/2022/file/dda7f9378a210c25e470e19304cce85d-Paper-Conference.pdf,F:\neurips_papers_python\2022\Leveraging Factored Action Spaces for Efficient Offline Reinforcement Learning in Healthcare.pdf
Structuring Representations Using Group Invariants,,2022,https://papers.nips.cc/paper_files/paper/2022/file/dcd297696d0bb304ba426b3c5a679c37-Paper-Conference.pdf,F:\neurips_papers_python\2022\Structuring Representations Using Group Invariants.pdf
Detection and Localization of Changes in Conditional Distributions,,2022,https://papers.nips.cc/paper_files/paper/2022/file/eb189151ced0ff808abafd16a51fec92-Paper-Conference.pdf,F:\neurips_papers_python\2022\Detection and Localization of Changes in Conditional Distributions.pdf
Left Heavy Tails and the Effectiveness of the Policy and Value Networks in DNN-based best-first search for Sokoban Planning,,2022,https://papers.nips.cc/paper_files/paper/2022/file/eb7295a8bc613b375726659c2ecd6f14-Paper-Conference.pdf,F:\neurips_papers_python\2022\Left Heavy Tails and the Effectiveness of the Policy and Value Networks in DNN-based best-first search for Sokoban Planning.pdf
Nonparametric Uncertainty Quantification for Single Deterministic Neural Network,,2022,https://papers.nips.cc/paper_files/paper/2022/file/eb7389b039655fc5c53b11d4a6fa11bc-Paper-Conference.pdf,F:\neurips_papers_python\2022\Nonparametric Uncertainty Quantification for Single Deterministic Neural Network.pdf
Regret Bounds for Risk-Sensitive Reinforcement Learning,,2022,https://papers.nips.cc/paper_files/paper/2022/file/eb4898d622e9a48b5f9713ea1fcff2bf-Paper-Conference.pdf,F:\neurips_papers_python\2022\Regret Bounds for Risk-Sensitive Reinforcement Learning.pdf
BILCO: An Efficient Algorithm for Joint Alignment of Time Series,,2022,https://papers.nips.cc/paper_files/paper/2022/file/eb5d9195b201ec7ba66c8e20b396d349-Paper-Conference.pdf,F:\neurips_papers_python\2022\BILCO_ An Efficient Algorithm for Joint Alignment of Time Series.pdf
Decoupling Features in Hierarchical Propagation for Video Object Segmentation,,2022,https://papers.nips.cc/paper_files/paper/2022/file/eb890c36af87e4ca82e8ef7bcba6a284-Paper-Conference.pdf,F:\neurips_papers_python\2022\Decoupling Features in Hierarchical Propagation for Video Object Segmentation.pdf
Giving Feedback on Interactive Student Programs with Meta-Exploration,,2022,https://papers.nips.cc/paper_files/paper/2022/file/eb6ac5a41d753c35e1c575b350d4116f-Paper-Conference.pdf,F:\neurips_papers_python\2022\Giving Feedback on Interactive Student Programs with Meta-Exploration.pdf
Refining Low-Resource Unsupervised Translation by Language Disentanglement of Multilingual Translation Model,,2022,https://papers.nips.cc/paper_files/paper/2022/file/eb1a323fa10d4102ff13422476a744ff-Paper-Conference.pdf,F:\neurips_papers_python\2022\Refining Low-Resource Unsupervised Translation by Language Disentanglement of Multilingual Translation Model.pdf
AniFaceGAN: Animatable 3D-Aware Face Image Generation for Video Avatars,,2022,https://papers.nips.cc/paper_files/paper/2022/file/eae78bf2712f222f101bd7d12f875a57-Paper-Conference.pdf,F:\neurips_papers_python\2022\AniFaceGAN_ Animatable 3D-Aware Face Image Generation for Video Avatars.pdf
Computationally Efficient Horizon-Free Reinforcement Learning for Linear Mixture MDPs,,2022,https://papers.nips.cc/paper_files/paper/2022/file/ebba182cb97864368fdb6ae00773a5e4-Paper-Conference.pdf,F:\neurips_papers_python\2022\Computationally Efficient Horizon-Free Reinforcement Learning for Linear Mixture MDPs.pdf
Counterfactual harm,,2022,https://papers.nips.cc/paper_files/paper/2022/file/ebcf1bff7b2fe6dcc3fbe666faaa50f1-Paper-Conference.pdf,F:\neurips_papers_python\2022\Counterfactual harm.pdf
Revisiting Optimal Convergence Rate for Smooth and Non-convex Stochastic Decentralized Optimization,,2022,https://papers.nips.cc/paper_files/paper/2022/file/ec045a5ca2d8cfc528591b4c34296370-Paper-Conference.pdf,F:\neurips_papers_python\2022\Revisiting Optimal Convergence Rate for Smooth and Non-convex Stochastic Decentralized Optimization.pdf
Training with More Confidence: Mitigating Injected and Natural Backdoors During Training,,2022,https://papers.nips.cc/paper_files/paper/2022/file/ec0c9ca85b4ea49c7ebfb503cf55f2ae-Paper-Conference.pdf,F:\neurips_papers_python\2022\Training with More Confidence_ Mitigating Injected and Natural Backdoors During Training.pdf
Chain of Thought Imitation with Procedure Cloning,,2022,https://papers.nips.cc/paper_files/paper/2022/file/ebdb990471f653dffb425eff03c7c980-Paper-Conference.pdf,F:\neurips_papers_python\2022\Chain of Thought Imitation with Procedure Cloning.pdf
Out-of-Distribution Detection via Conditional Kernel Independence Model,,2022,https://papers.nips.cc/paper_files/paper/2022/file/ec14daa5c50745f83fb27f685f8dfc22-Paper-Conference.pdf,F:\neurips_papers_python\2022\Out-of-Distribution Detection via Conditional Kernel Independence Model.pdf
Online Convex Optimization with Hard Constraints: Towards the Best of Two Worlds and Beyond,,2022,https://papers.nips.cc/paper_files/paper/2022/file/ec360cb73d322e80a877b7ec7e13c79a-Paper-Conference.pdf,F:\neurips_papers_python\2022\Online Convex Optimization with Hard Constraints_ Towards the Best of Two Worlds and Beyond.pdf
"ResT V2: Simpler, Faster and Stronger",,2022,https://papers.nips.cc/paper_files/paper/2022/file/ec3acc7700fc5be9a8e257b38f870855-Paper-Conference.pdf,"F:\neurips_papers_python\2022\ResT V2_ Simpler, Faster and Stronger.pdf"
Object-Category Aware Reinforcement Learning,,2022,https://papers.nips.cc/paper_files/paper/2022/file/ec3d49763c653ad7c8d587f52220c129-Paper-Conference.pdf,F:\neurips_papers_python\2022\Object-Category Aware Reinforcement Learning.pdf
Learning Partial Equivariances From Data,,2022,https://papers.nips.cc/paper_files/paper/2022/file/ec51d1fe4bbb754577da5e18eb54e6d1-Paper-Conference.pdf,F:\neurips_papers_python\2022\Learning Partial Equivariances From Data.pdf
Photorealistic Text-to-Image Diffusion Models with Deep Language Understanding,,2022,https://papers.nips.cc/paper_files/paper/2022/file/ec795aeadae0b7d230fa35cbaf04c041-Paper-Conference.pdf,F:\neurips_papers_python\2022\Photorealistic Text-to-Image Diffusion Models with Deep Language Understanding.pdf
A Simple Decentralized Cross-Entropy Method,,2022,https://papers.nips.cc/paper_files/paper/2022/file/ec9dc93250548578aa4569aa19acfd81-Paper-Conference.pdf,F:\neurips_papers_python\2022\A Simple Decentralized Cross-Entropy Method.pdf
Do Residual Neural Networks discretize Neural Ordinary Differential Equations?,,2022,https://papers.nips.cc/paper_files/paper/2022/file/ecc38927fe5148c66bee64ee8fed1e76-Paper-Conference.pdf,F:\neurips_papers_python\2022\Do Residual Neural Networks discretize Neural Ordinary Differential Equations_.pdf
Generative multitask learning mitigates target-causing confounding,,2022,https://papers.nips.cc/paper_files/paper/2022/file/ece182f93af26c64187ba3f7dfd4309a-Paper-Conference.pdf,F:\neurips_papers_python\2022\Generative multitask learning mitigates target-causing confounding.pdf
Diffusion-based Molecule Generation with Informative Prior Bridges,,2022,https://papers.nips.cc/paper_files/paper/2022/file/eccc6e11878857e87ec7dd109eaa9eeb-Paper-Conference.pdf,F:\neurips_papers_python\2022\Diffusion-based Molecule Generation with Informative Prior Bridges.pdf
Revisit last-iterate convergence of mSGD under milder requirement on step size,,2022,https://papers.nips.cc/paper_files/paper/2022/file/eceb7374fb94b4efd0fe4bea550d4285-Paper-Conference.pdf,F:\neurips_papers_python\2022\Revisit last-iterate convergence of mSGD under milder requirement on step size.pdf
Are You Stealing My Model? Sample Correlation for Fingerprinting Deep Neural Networks,,2022,https://papers.nips.cc/paper_files/paper/2022/file/ed189de2611f200bd4c2ab30c576e99e-Paper-Conference.pdf,F:\neurips_papers_python\2022\Are You Stealing My Model_ Sample Correlation for Fingerprinting Deep Neural Networks.pdf
SecureFedYJ: a safe feature Gaussianization protocol for Federated Learning,,2022,https://papers.nips.cc/paper_files/paper/2022/file/ed3c686f9cda57e56cc859402c775414-Paper-Conference.pdf,F:\neurips_papers_python\2022\SecureFedYJ_ a safe feature Gaussianization protocol for Federated Learning.pdf
When to Trust Your Simulator: Dynamics-Aware Hybrid Offline-and-Online Reinforcement Learning,,2022,https://papers.nips.cc/paper_files/paper/2022/file/ed3cd2520148b577039adfade82a5566-Paper-Conference.pdf,F:\neurips_papers_python\2022\When to Trust Your Simulator_ Dynamics-Aware Hybrid Offline-and-Online Reinforcement Learning.pdf
Data-Efficient Structured Pruning via Submodular Optimization,,2022,https://papers.nips.cc/paper_files/paper/2022/file/ed5854c456e136afa3faa5e41b1f3509-Paper-Conference.pdf,F:\neurips_papers_python\2022\Data-Efficient Structured Pruning via Submodular Optimization.pdf
Polyhistor: Parameter-Efficient Multi-Task Adaptation for Dense Vision Tasks,,2022,https://papers.nips.cc/paper_files/paper/2022/file/efb02f96766a3b599c76852abf4d42dd-Paper-Conference.pdf,F:\neurips_papers_python\2022\Polyhistor_ Parameter-Efficient Multi-Task Adaptation for Dense Vision Tasks.pdf
ViewFool: Evaluating the Robustness of Visual Recognition to Adversarial Viewpoints,,2022,https://papers.nips.cc/paper_files/paper/2022/file/eee7ae5cf0c4356c2aeca400771791aa-Paper-Conference.pdf,F:\neurips_papers_python\2022\ViewFool_ Evaluating the Robustness of Visual Recognition to Adversarial Viewpoints.pdf
Predicting Label Distribution from Multi-label Ranking,,2022,https://papers.nips.cc/paper_files/paper/2022/file/efc549c2d22edf2f244b7013387c6251-Paper-Conference.pdf,F:\neurips_papers_python\2022\Predicting Label Distribution from Multi-label Ranking.pdf
LAPO: Latent-Variable Advantage-Weighted Policy Optimization for Offline Reinforcement Learning,,2022,https://papers.nips.cc/paper_files/paper/2022/file/efb2072a358cefb75886a315a6fcf880-Paper-Conference.pdf,F:\neurips_papers_python\2022\LAPO_ Latent-Variable Advantage-Weighted Policy Optimization for Offline Reinforcement Learning.pdf
"PDSketch: Integrated Domain Programming, Learning, and Planning",,2022,https://papers.nips.cc/paper_files/paper/2022/file/efe36e55d80a94d1726f660b8d237a0f-Paper-Conference.pdf,"F:\neurips_papers_python\2022\PDSketch_ Integrated Domain Programming, Learning, and Planning.pdf"
On Margin Maximization in Linear and ReLU Networks,,2022,https://papers.nips.cc/paper_files/paper/2022/file/f062da1973ac9ac61fc6d44dd7fa309f-Paper-Conference.pdf,F:\neurips_papers_python\2022\On Margin Maximization in Linear and ReLU Networks.pdf
Heterogeneous Skill Learning for Multi-agent Tasks,,2022,https://papers.nips.cc/paper_files/paper/2022/file/f0606b882692637835e8ac981089eccd-Paper-Conference.pdf,F:\neurips_papers_python\2022\Heterogeneous Skill Learning for Multi-agent Tasks.pdf
